Date,Time,Location,Operator,Flight No,Route,AC Type,Registration,CN / LM,Aboard,Fatalities,Ground,Summary,Latitude,Longitude
"December 18, 1945",10:10,"Voksenkollen, Norway",Military - Royal Air Force,?,?,Douglas C-47B,KN413,16090/32838,17,15,0,Flew into the side of a hill.,59.9800595,10.6653012
"December 18, 1947",08:45,"Krasnoyarsk, Russia",Aeroflot,6,Krasnoyarsk - Omsk,Ilyushin IL-12,L-1343,?,25,9,0,Crash landed due to engine failure after an attempted go-around.,56.01528339999999,92.8932476
"December 18, 1949",20:30,"Aulnay-sous-Bois, France",Sabena,?,?,Douglas C-47A-60-DL,OO-AUQ,10241,8,8,0,Crashed after the wing failed during takeoff.,48.9412151,2.4970711
"December 18, 1954",14:00,"New York, New York",Linee Aeree Italiane,451,Rome - New York City,Douglas DC-6B,I-LINE,44418/487,32,26,0,"The plane crashed into approach lights of the runway during the fourth landing attempt at Idlewild Airport, sinking into Jamaica  Bay. An erratic approach which resulted in a descent to an altitude too low to avoid striking the pier. A contributing factor was pilot fatigue due to the particular and difficult circumstances including two and one-half hours in a holding pattern.",40.7127837,-74.0059413
"December 18, 1954",?,"Near Bolivar, Venezuela",Linea Aeropostal Venezolana,?,Bolivar - Tumeremo,Douglas C-47A,YV-C-AMP,19292,2,2,0,The cargo plane crashed into a mountain while en route.,6.3585216,-63.580611
"December 18, 1957",?,"Near Birobidzhan, Russia",Aeroflot,10,?,Ilyushin IL-12,L1309,?,27,27,0,"In June 1958 the aircraft was found on the northwest slope of Mount Poktoy 30 km west of Birobidzhan completely destroyed and burned. Crews, ATC error.",48.78035740000001,132.9130744
"December 18, 1966",02:55,"Bogota, Colombia",Aerocondor de Colombia,?,Miami - Bogota,Lockheed L-1649A Starliner,N7301C,1002,59,17,0,Crash landed short of the runway on approach in fog. Pilot error. Presence of unauthorized person in the cockpit distracting the pilot. Lack of cockpit supervision. Poor weather.,4.710988599999999,-74.072092
"December 18, 1973",19:14,"Manhattan, Kansas",Capitol Air Service - Air Taxi,?,"Norman, OK - Manhattan, KS",Cessna 310L,N3269X,?,2,2,0,"Following ground contact, the aircraft became airborne for a distance of 525 ft., struck power lines and crashed.",39.18360819999999,-96.57166939999999
"December 18, 1976",16:56,"Nnear Yuzhno-Sakhalinsk, Russia",Aeroflot,?,Petropavlovsk-Kamchatsky - Yuzhno-Sakhalinsk,Ilyushin IL-14M,CCCP-61752,147001247,8,8,0,Deviated from the approach pattern and crashed into Mount Ostraya.,46.9641127,142.7347556
"December 18, 1977",01:38,"Near Salt Lake City, Utah",United Air Lines,2860,"San Francisco, CA - Salt Lake City, Utah",Douglas DC-8-54F,N8047U,45880/275,3,3,0,"While in a holding pattern because of electrical problems the cargo plane cashed into 7,600 ft. mountain. The approach controller's issuance and the flight crew's acceptance of an incomplete and ambiguous holding clearance in combination with the flight crew's failure to adhere to prescribed impairment-of-communications procedures and prescribed holding procedures. The controller's and flight crew's actions are attributed to probable habits of imprecise communication and of imprecise adherence to procedures developed through years of exposure to operations in a radar environment. Contributing to the accident was the failure of the aircraft's No.1 electrical system for unknown reasons.",40.7607793,-111.8910474
"December 18, 1977",?,"Off Madeira, Portugal",SATA,730,Geneva - Funchal,Aerospatiale Caravelle 10R,HB-ICK,200,57,36,0,Ditched into the ocean while on a second approach. Crew error. Sensory illusion.,32.76070740000001,-16.9594723
"December 18, 1981",13:06,"Near Covenas, Colombia",ACES Colombia,?,?,de Havilland Canada DHC-6 Twin Otter 300,HK-2217,609,13,13,0,Struck high ground.,9.402597,-75.68164200000001
"December 18, 1995",?,"Cahungula, Angola",Trans Service Airlift,?,Jamba Airport - ?,Lockheed L-188C Electra,9Q-CRR,1080,144,141,0,"The plane, chartered by the UNITA rebel movement, stalled and crashed shortly after takeoff from Jamba. Overloaded by 40 passengers. One report stated baggage shifted to the rear of the plane.",-7.8,19.433333
"December 18, 2003",22:00,"Mitu, Colombia",Líneas Aéreas Suramericanas,?,El Yopal - Mitu,Douglas DC-9-15F,HK-4246X,47062,3,3,0,"While on approach to , the cargo plane obtained the authorization to descend from 23,000 to 7,000 ft. but  disappeared from radar screen when it struck a mountain. Wreckage was found 5 days later.",1.2521739,-70.23361799999999
"December 19, 1929",?,"Near Berlin, Germany",Deutsche Lufthansa,?,Marseille - Berlin,Arado V1,D-1594,47,3,2,0,Pilot lost his bearing in fog and crashed.,52.52000659999999,13.404954
"December 19, 1936",20:47,"Near Milford, Pennsylvania",Eastern Air Lines,14,"Miami, FL - Charleston, SC - Newark, NJ",Douglas DC-2-112,NC13732,1258,14,14,0,"Crashed into trees in poor weather while attempting to land at Newark. Error on the part of the pilot for attempting to get down under the overcast without first definitely proving his position.  Improper dispatching for clearing the flight into an area of predicted bad weather, particularly when the area cleared through did not permit a safe return, and static conditions encountered which rendered reception of the radio range signals over the airplane's range receivers unintelligible.",41.322316,-74.8023882
"December 19, 1942",c 16:00,"Near Vienna, Austria",DDL,?,"Copenhagen, Denmark - Budapest, Hungary",Junkers JU-52/3m,OY-DAL,5610,18,18,0,Crashed while attempting to land at Vienna to refuel.,48.2081743,16.3738189
"December 19, 1943",09:20,"Canal Creek, Australia",Military - U.S. Air Force,?,?,Douglas C-47A-60-DL,43-30742,13893,31,31,0,?,-22.9779158,150.2743921
"December 19, 1950",07:30,"Near Baguio, Philippines",Military - U.S. Air Force,?,Naha AB - Clark AB,Douglas C54E-DO (DC-4),44-9096,27322,38,38,0,"Proceeding on instruments, the aircraft crashed into Mt. Tabayoc while en route.  Navigation error.",16.4023332,120.5960071
"December 19, 1953",18:55,"Zurich, Switzerland",Sabena,?,Brussels - Zurich,Convair CV-240,OO-AWO,128,44,1,0,Descended below the glide path in poor weather and darkness and crashed 1.5 miles short of the runway. Poor approach procedures performed by the pilot.,47.3768866,8.541694
"December 19, 1955",?,"Sao Paulo, Brazil",Cruzeiro Do Sud,?,Sao Paulo - Belem,Douglas DC-3,?,?,26,26,0,Crashed on takeoff.,-23.5505199,-46.63330939999999
"December 19, 1962",19:30,"Warsaw, Poland",LOT Polish Airlines,?,Berlin - Warsaw,Vickers Viscount 804,SP-LVB,395,33,33,0,Stalled and crashed 8 miles from the threshold after being struck by lightning.,52.2296756,21.0122287
"December 19, 1970",?,"Panarah, Pakistan",Military - Russian Air Force,?,?,Antonov AN-22,CCCP-09305,9340205,17,17,0,Crashed during an emergency landing with engines on fire.
"December 19, 1977",07:48,"Vieques, Puerto Rico",Vieques Air Link,?,"St Croix, VI - Vieques, PR",Britten-Norman BN-2A Islander,N862JA,184,10,5,0,The plane made a forced landing in the ocean. Fuel exhaustion. Inadequate preflight planning. Mismanagement of fuel.,18.1487255,-65.4419334
"December 19, 1978",16:58,"Morton, Illinois",Galesburg Aviation - Air Taxi,?,"Terra Haute, IN - Moline, IN",Cessna 210L,N4638Q,21059538,2,2,0,Collided with wires in fog and low ceiling. Continued VFR flight into adverse weather conditions.,40.6128161,-89.45926089999999
"December 19, 1979",?,"Cerro Toledo Mountain, Colombia",SATENA,?,Arauca - Bogota,Douglas DC-4 (C-54),FAC-1106,10853,19,19,0,Flew into a mountain.
"December 19, 1984",c 14:00,"Near Jaen, Peru",Fuerza Aérea del Peru,?,?,de Havilland Canada DHC-6 Twin Otter 300,FAP-307,317,21,21,0,"Crashed in flames, two minutes after taking off from a military base.",-5.709441200000001,-78.7986181
"December 19, 1997",16:13,"Near Palembang, Indonesia",SilkAir,185,Jakarta - Hatta - Singapore,Boeing B-737-300,9V-TRF,28556/2851,104,104,0,"The plane disappeared off radar screens and shortly after, crashed into the Musi River. The plane, almost brand-new, cruising in good weather and with an experienced crew, suddenly left normal flight from 35,000 feet and crashed at a high rate of speed into the Sumatran jungle. The right wing and parts of the rudder separated from the aircraft before it crashed. The Indonesian National Transportation Committee found that there was insufficient evidence to find a cause for the accident. The U.S. National Transportation Safety Board strongly disagreed and stated the jet's cockpit voice recorder was intentionally disconnected and its flight controls placed in a nose-down position most likely by the captain. While the U.S. NTSB stopped short of using the term suicide, its dissenting report made it clear it believed the crash was the result of actions by the captain. In July 2004 a California jury found the manufacturer of the PCU valve that controls rudder responsible for the accident after the valve was located and showed defects which may have led to a rudder hardover.",-2.9760735,104.7754307
"December 19, 2005",14:40,"Off Miami Beach, Florida",Chalk's Ocean Airways,101,"Miami, Florida - Bimini, Bahamas",Grumman G73T Turbo Mallard,N2969,J-27,20,20,0,"The seaplane crashed off Miami Beach next to a jetty as it was taking off. There was an explosion and fire and the right wing separated prior to the plane impacting the water. Examination of the wreckage revealed fatigue cracks in the right wing. The failure of Chalk's Ocean Airways' maintenance program to identify and properly repair fatigue cracks in the wing, and the failure of the FAA to detect and correct deficiencies in the company's maintenance program. Although a 16-inch crack in the wing had been patched, a more significant flaw in a nearby support beam hadn't been repaired. The carrier had no record of patching the crack.",28.350488,-82.6928396
"December 20, 1928",?,"Huron, Ohio",National Air Transport,?,Cleveland - Chicago,Douglas M-4,NC790,653,1,1,0,The mail plane crashed into an apple tree during a snow storm after the pilot experienced spatial disorientation.,41.3950489,-82.55517329999999
"December 20, 1934",c 0:30,"Rutbah Wells, Syria",KLM Royal Dutch Airlines,?,"Amsterdam - Batavia, Java",Douglas DC-2-115A,PH-AJU,1317,7,7,0,"Crashed and burned about half-way between Baghdad and Gaza after running into bad weather. The aircraft was named ""Uiver"" (Dutch word for stork)."
"December 20, 1942",c 19:00,"Near Chilliwack, British Columbia, Canada",Canadian Pacific Air Lines,?,Prince George - Vancouver,Lockheed 14-H2 Super Electra,CF-CPD,?,13,13,0,"Crashed into the slopes of M.t Cheam at 7,000 feet. Possible complete electrical failure resulting in the deviation from the prescribed route.",49.1579401,-121.9514666
"December 20, 1952",c 06:30,"Moses Lake, Washington",Military - U.S. Air Force,?,?,Douglas C-124A Globemaster,50-100,43238,115,87,0,Within two minutes after takeoff the aircraft began to lose altitude. It crashed and burned into a snow laden field at the end of the airstrip. Failure of the pilot to remove the rudder and elevator locking pin prior to taking off.,47.1301417,-119.2780771
"December 20, 1962",?,"Kadena AB, Okinawa",Military - U.S. Air Force,?,?,KB-50,?,?,12,12,0,"Twelve killed, including civilians. Two civilian houses burnt.",26.3556897,127.7678754
"December 20, 1972",18:00,"Chicago, Illinois",Delta Air Lines/ North Central Airlines,954/575,Tampa - Chicago / Chicago - Madison,Convair CV-880 / McDonnell DC-9-31,N8897E/N954N,22-00-29 / 47159/231,133,10,0,"The Delta Convair, taxing across Runway 27L, after landing in heavy fog, was hit by the North Central DC-9 as it took off, shearing off its tail. The DC-9 came crashing back down on the runway and caught fire. Ten people out of 45 aboard the DC-9 were killed. None of the 88 aboard the Convair were killed. The ATC gave ambiguous instructions to the Delta crew, did not use all available information to determine the location of the CV-880 and the CV-880 crew did not request clarification of the controller's instructions.",41.8781136,-87.6297982
"December 20, 1995",21:38,"Near Buga, Valle del Cauca, Colombia",American Airlines,965,Miami - Cali,Boeing B-757-223,N651AA,24609/390,164,160,0,"While on a flight from Miami, FL to Cali, Columbia the aircraft crashed into Mt. El Deluvio 38 miles north of Cali while attempting to land. On approach, the crew was requested to report over Tulua VOR which they already passed. This confused them and they decided to go direct to Rozo beacon. Entering the abbreviation ""R"", incorrectly steered the plane towards Bogota. More than a minute into the  turn the crew steered manually toward Cali, but this now took them into the path of a mountain. Crew error. Lack of situational awareness, failure to adequately plan and execute the approach, failure to realize that the FMS had turned the aircraft toward mountains. Crew also neglected to retract the speed brakes after the Ground Proximity Warning System alert.  Lack of adequate radar. Different  Flight Management System naming convention from that published in navigational charts.",3.9005079,-76.30218889999999
"December 20, 1997",?,"Tanagra, Greece",Military - Greek Air Force,?,Search mission,Lockheed C-130H Hercules,750,4729,5,5,0,Crashed in the Pastra mountains while searching for the wreckage of an Aerosweet Yak-42 that was missing.,38.3275438,23.5366453
"December 20, 2001","22""08","Zurich, Switzerland",Eagle Air,?,?,Cessna 560 Citation V,HB-VLV,560-0077,2,2,0,"After reaching a height of 500 ft. the aircraft began to loose altitude until the plane impacted the ground at the end of Runway 34. The crew lost spatial orientation after take-off, leading to an unintentional loss of altitude. The copilot's basic training in instrument flying did not include night instrument take-offs. The crew's method of working was adversely affected by great time pressure. Executing the take-off as a rolling take-off was not adapted to the prevailing meteorological conditions.",47.3768866,8.541694
"December 21, 1924",?,"Goshen, Indiana",US Aerial Mail Service,?,?,De Havilland DH-4,311,?,1,1,0,?,41.5822716,-85.8344383
"December 21, 1939",c 13:00,Off Malta-Luqa,Imperial Airways,?,Egypt - England,Lockheed 14 Super Electra,G-AFYU,1444,11,5,0,"Ditched into the sea, 300 miles NW of Alexandria, Egypt. A ship rescued six survivers.",35.880334,14.4852504
"December 21, 1948",14:00,"Basalt Island, Hong Kong",China National Aviation Corporation,?,Shanghai - Hong Konk,Douglas C-54B-5-DO,XT-104,18348,33,33,0,"Crashed on Balsalt Island  while attempting a visual approach through clouds. The pilot came down through a hole in the overcast but became trapped when the weather closed in. He reversed course but crashed into a small mountain. Pilot error. Quentin Roosevelt, son of Teddy Roosevelt killed.",22.3156377,114.365341
"December 21, 1948",15:00,"Near Pilos, Greece",Ceskoslovenske Aerolinie,?,Rome - Athens,Douglas DC-3,OK-WDE,12894,24,24,0,Crashed in the Taigetos Mountains while en route after being shot down by Greek insurgents,36.91307560000001,21.6963472
"December 21, 1952",?,"Off Miami, Florida",Rutas Aéreas Nacionales SA,?,?,Curtiss C-46D,YV-C-ARC,33486,3,3,0,Disappeared over the Atlantic. Never found.,28.350488,-82.6928396
"December 21, 1953",?,"Dah-el-Kadeeb, Syria",Syrian Airways,?,?,Douglas DC-3,YK-AAF,TDB,15,9,0,?
"December 21, 1955",03:43,"Jacksonville, Florida",Eastern Air Lines,642,Miami - Jacksonville,Lockheed 749C-79-12 Constellation,N112A,2533,17,17,0,The plane crashed while on approach and during an attempted go-around.  The crew allowed the aircraft to deviate to the left of course and descent below the glide path for reasons unknown.  The crew encountered local fog and restricted visibility during the final approach of an ILS approach and missed approach procedure came too late to prevent the aircraft from descending into the ground.,30.3321838,-81.65565099999999
"December 21, 1959",07:16Z,"Rome, Italy",Alitalia,?,Training,Vickers 785D Viscount,I-LIZT,378,2,2,0,Crashed into a hanger during a practice landing. The accident was attributed to a balked landing maneuver carried out below the speed limits for safe directional control of the aircraft during a critical situation that developed in the last phase of the landing in the course of a simulated emergency exercise with two power units inoperative.,41.9027835,12.4963655
"December 21, 1961",?,"Ankara, Turkey",British European Airways,?,Ankara - Nicosia,de Havilland Comet 4B,G-ARJM,06456,34,27,0,"Shortly after taking off from Esenboga Airport, the aircraft assumed an excessively steep climbing angle, stalled and crashed. The probable cause of the accident was the obstruction of the pitch pointer in the captain's director horizon which led him to make an excessively steep climb. One of three screws had worked its way loose and blocked the pointer on the dial from indicating the correct pitch.",39.9333635,32.8597419
"December 21, 1964",18.40,"Near Kaliba, Philippines",Fleming Airways System Transport,?,Kalibo - Manila,Douglas DC-3,PI-C569,20396,39,1,0,"After losing the No. 1 engine the pilot decided to return to Kalibo but could not land do to poor weather. He attempted to divert to Bacolod but could not climb to avoid terrain and crashed into a fish pond while attempting to ditch in the sea.  Failure to maintain safe single engine speed and altitude following failure of the left engine. The precipitation and poor visibility prevailing at the time of the accident over Kalibo and its vicinity and the failure on the part of the maintenance personnel to take action to correct discrepancies logged in the aircraft log-book, individually or collectively contributed to the cause of the accident.",11.6892241,122.367428
"December 21, 1967",16:00,"Denver, Colorado",Frontier Airlines,?,"Denver, CO - Scottsbluff, NE",Douglas C-47A,N65276,19202,2,2,0,The cargo plane crashed on takeoff. The failure of the crew to perform a pre-takeoff control check resulting in takeoff with the elevators immobilized by a control batten.,39.7392358,-104.990251
"December 21, 1967",?,"Creag Bhan, England",Military - Royal Air Force,?,?,Avro Shackleton MR-3,XF702,?,13,13,0,Struck a mountain. Icing,52.3555177,-1.1743197
"December 21, 1971",?,"Sofia, Bulgaria",Balkan Bulgarian Airlines,?,Sofia IAP - Algiers,Ilyushin IL-18B,LZ-BES,185008104,73,28,0,Crashed in adverse weather conditions shortly after taking off.,42.6977082,23.3218675
"December 21, 1972",?,"Near Pakse, Laos",Military - U.S. Air Force,?,?,Lockheed AC-130A Hercules,56-0490,3098,16,14,0,Shot down by enemy fire. Fuel began to leak and an explosion tore off the left wing. Two crew members parachuted to safety.,15.1105068,105.8172881
"December 21, 1972",?,"Off St. Maarten off, Netherlands Antilles",Air Guadeloupe,?,Guadeloupe - St. Maarten,de Havilland Canada DHC-6 Twin Otter 300,F-OGFE,258,13,13,0,Crashed on approach into the sea.
"December 21, 1973",?,"Near Siagon, South Vietnam",Military - Vietnamese Air Force,?,?,Boeing Vertol CH-47 (helilcopter),?,?,20,20,0,Ammunition exploded while the aircraft was on the ground.,10.8230989,106.6296638
"December 21, 1973",?,"Talara, Peru",TAM (Bolivia),?,US - La Paz,Convair CV-440,TAM-47,444,9,6,0,Crashed on approach.,-4.581151999999999,-81.26289609999999
"December 21, 1975",?,"Tacloban, Philippines",Philippine Aerotransport,?,?,Britten-Norman BN-2A-21 Islander,RP-C2136,440,9,9,0,?,11.2543388,124.9616867
"December 21, 1977",?,"Nanisivik, Canada",Kenn Borek Air,?,?,de Havilland Canada DHC-6 Twin Otter 300,CF-ABW,278,8,8,0,"The pilot lost control of the aircraft and crashed 2,200 ft. short of the runway in a 45 degree nose-down and right bank attitude while attempting to land. Unknown possible turbulence including windshear or mechanical failure of the flaps/ailerons.",73.037256,-84.534492
"December 21, 1978",14:30,"Chevak, Alaska",Chugiak Aviation - Air Taxi,?,"St. Marys, AK - Chevak, AK",Cessna 207,N7378U,?,7,2,0,Pilot flew into white out conditions and suffered spatial disorientation. Continued VFR flight into adverse weather conditions.,61.5277778,-165.5863889
"December 21, 1980",14:23,"Near Rio Hacha, Colombia",Transportes Aereos del Caribe,?,Rio Hacha - Medellin,Aerospatiale Caravelle 6R,HK-1810,165,70,70,0,A fire and explosion took place 5 minutes after taking off. The explosion was possibly caused by a bomb placed in the rear section of the aircraft.,11.5384151,-72.91678379999999
"December 21, 1987",15:10,"Bordeaux, France",Air Littoral,?,Brussels - Bordeaux,Embraer 120 Brasilia,F-GEGH,120-033,16,16,0,Crashed short of the runway and struck trees in fog after being diverted due to the weather.,44.837789,-0.57918
"December 21, 1987",?,Eugene Island,Air Taxi - Petroleum Helicopters Inc.,?,?,Aerospatiale SA-330J,N3596N,1588,15,15,0,The helicopter crashed while attempting to land on an oil rig. Improper planned approach. Clearance not maintained.,29.763832,-93.0882046
"December 21, 1988",19:03,"Lockerbie, Scotland",Pan American World Airways,103,London - New York City,Boeing B-747-121A,N739PA,19646/15,259,259,11,"The airliner disappeared from radar shortly after leveling off at FL 310 while on a flight from Heathrow Airport, London,  to New York. The aircraft broke up with two main sections of wreckage coming down in the town of Lockerbie. Detonation of an explosive device in the forward cargo area planted by terrorists.  Musician Paul Jeffreys killed. The aircraft was named ""Clipper Maid of the Seas.""",55.12224500000001,-3.349008
"December 21, 1989",c 14:00,"Near Guayaramerin, Bolivia",Military - Bolivian Air Force,?,Guayaramerin - Santa Cruz,Lockheed C-130A,TAM-62,3187,28,24,0,The passenger flight crashed into a jungle shortly after taking off.,-10.8237579,-65.3688335
"December 21, 1990",12:20,"Near False Pass, Alaska",MarkAir Commuter,?,Cold Bay - False Pass,Cessna 208 Caravan I,N9444F,208-00104,1,1,0,The cargo plane crashed into mountains while approaching False Pass. The pilot's improper decision to continue flight into an area of mountainous terrain and adverse weather conditions. the terrain and weather were factors.,54.8508333,-163.415
"December 21, 1992",07:53,"Faro, Algarve, Portugal",Martinair Holland NV,495,Amsterdam - Faro,McDonnell Douglas DC-10-30CF,PH-MBN,46924,340,56,0,"While attempting a second landing in high winds, during a storm, the aircraft's wing tip hit the runway resulting in the aircraft departing the runway and causing a fuel tank to explode. The high rate of descent in the final phase of the approach and the landing made on the right landing gear which exceeded the structural limitations of the aircraft.The crosswind, which exceeded the aircrafts limits and which occurred in the final phase of the approach and during landing. The combination of both factors caused stresses which exceeded the structural limitations of the aircraft. In addition, there were four moments when the pilots should have decided to abort the landing and do a go-around. This because the runway was flooded with water, the plane had left the flight path and was unstable during landing. In addition, the pilots did not properly correct for the windshear, flew too slowly and made errors with the automatic pilot.",37.0193548,-7.9304397
"December 21, 1994",09:53,"Coventry, England",Phoenix Aviation,702,East Midlands - Coventry,Boeing 737-2D6C,7T-VEE,20758/322,5,5,0,After a go-around the plane struck a transmission tower and crashed.,52.406822,-1.519693
"December 21, 1996",22:32,"Rio Negro, Colombia",SELVA,?,Bogota - Medellin,Antonov An-32B,HK-4008X,3402,4,4,0,The cargo plane crashed short of the runway while attempting to land.,6.144837,-75.375085
"December 21, 1999",09:40,"Guatemala City, Guatemala",Cubana de Aviacon,261,Havana - Guatemala City,McDonnell Douglas DC-10-30,F-GTDI,46890/77,314,16,2,"While attempting to land at La Aurora International Airport, the aircraft overshot the runway, rolled down an embankment and crashed into houses in the La Libertad section of the city. Witnesses say the plane was unable to stop after it began its landing too far down the runway. The crew failed to initiate a go-around after overshooting on a wet runway with insufficient deceleration to make a safe stop. Leased from AOM.",14.6349149,-90.5068824
"December 21, 2002",01:52,"Off Pachao Tao, Taiwan",Transasia Airways,791,Taipei - Macau,Aérospatiale/Aeritalia ATR-72-202,B-22708,322,2,2,0,While en route the stall warning sounded and the stick shaker activated. The crew of the cargo plane disconnected the autopilot and tried to gain control of the plane. The plane began to descend from FL170 until it impacted the ocean.
"December 22, 1934",02:52,"Sunbright, Tennessee",American Airlines,?,"Louisville, KY - Nashville, TN",Lockheed Orion 9D,NC12286,?,1,1,0,"Crashed into Big Pilot mountain, 50 feet from the top of the summit, four miles from Sunbright, in poor visibility.",36.2431964,-84.6715407
"December 22, 1950",13:53,"Penticton, British Columbia, Canada",Canadian Pacific Air Lines,4,Vancouver - Penticton,Douglas DC-3,CF-CUF,12855,18,2,0,Struck trees on  Mt. Okanagan while making an approach to Penticton. Drifted below the minimum altitude permissible.,49.4991381,-119.5937077
"December 22, 1952",?,"Damascus, Syria",Syrian Air,?,?,Douglas DC-3,?,?,?,9,?,?,33.5138073,36.2765279
"December 22, 1954",23:00,"Pittsburgh, Pennsylvania",Johnson Flying Service,4844-C,Newark - Tacoma,Douglas DC-3,N24320,20197,28,10,0,Ditched into the Monongahela River after running out of fuel. Inadequate flight planning. Contributing factors were inadequate crew supervision and training.,40.44062479999999,-79.9958864
