Date,Time,Location,Operator,Flight No,Route,AC Type,Registration,CN / LM,Aboard,Fatalities,Ground,Summary,Latitude,Longitude
"April 01, 1935",?,"Beauvais, France",Air France,?,?,Farman F-300,F-ALHQ,?,3,1,0,"Chief pilot of Air France, Robert Bajac, 36, killed.",49.42953869999999,2.0807123
"April 01, 1936",19:10,"Pavillon, New York",American Airlines,?,"Newwark, N.J. - Buffalo, NY",Stinson Model A,NC15152,?,2,2,0,The mail plane explosion in mid-air before crashing to the ground in a snowstorm.,42.8761123,-78.0228829
"April 01, 1946",10:00,"near Craigavad, Northern Ireland",Railway Air Services Ltd.,?,Liverpool - Belfast,de Hvilland 89A Dragon Rapide,G-AERZ,?,6,6,0,Crashed 5 miles north northeast of belfast while attempting to land in advese weather. Pilot error. The pilot failed to maintain a course necessary to avoid higher terrain.,54.65307,-5.764296
"April 01, 1956",19:20,"Pittsburgh, Pennsylvania",Trans World Airlines,400,Pittsburgh - Newark,Martin 404,N40403,14103,36,22,0,"The aircraft yawed to the left and crashed shortly after takeoff after a fire warning occurred on the No.1 engine. The cause of the fire warning was a failed exhaust connector clamp in the left engine, which triggered an adjacent fire detecting unit. A windmilling left propeller, the extended landing gear, and the takeoff flaps produced sufficient drag to make the airplane lose altitude and strike the ground. An uncoordinated emergency action in a very short time available to the crew, which produced an aircraft configuration with insurmountable drag.",40.44062479999999,-79.9958864
"April 01, 1967",15:50,"Phelan, California",Ace Flying Service,?,?,Piper PA-30,N7979Y,?,2,2,0,The aircraft struck a mountain. Continued VFR flight into adverse weather conditions.,34.426288,-117.5725628
"April 01, 1968",?,"Off Phu Quoc, Vietnam",Military - U.S. Navy,?,?,Lockheed P-3B Orion,153445,185-5241,12,12,0,Shot down by enemy fire.,10.1586245,103.98402
"April 01, 1970",04:07,"Novosibirsk, Russia",Aeroflot,1661,Krasnoyarsk - Novosibirs,Antonov AN-24V,CCCP-47751,79901204,45,45,0,The aircraft crashed after colliding with a weather balloon and disintegrated in the air.,55.00835259999999,82.9357327
"April 01, 1970",08:16,"Casablanca, Morocco",Royal Air Maroc,?,Agadir - Casablanca,Aerospatiale Caravelle 3,CN-CCV,032/33,82,61,0,The aircraft crashed 9.7 km short of the runway during approach in the fog and broke in two.,33.5731104,-7.589843399999999
"April 01, 1981",?,"Mt. Hagen, Papua, New Guinea",Talair,?,?,Cessna 402,P2-GKJ,?,8,8,0,?,-5.8581876,144.2429343
"April 01, 1987",21:30,"Anchorage, Alaska",Air Taxi,?,Local Flight,Cessna 402,N967JW,4020067,2,2,0,The aircraft was on the last leg of a commuter flight when it crashed in a heavily wooded area while making a VFR approach to Merrill Field. The plane struck the ground in a near vertical attitude. Fuel starvation. Auxiliary tank had fuel but the engines could not be restarted from those tanks.,61.2180556,-149.9002778
"April 01, 1991",15:00,"Off San Pedro, Belize",Tropic Air - Air Taxi,?,Zeldiver - San Pedro,Cessna 402B,N402BL,402B0827,8,8,0,The air taxi crashed into the Caribbean.
"April 01, 1993",16:15,"Aspen, Colorado",Air Taxi - Sea Pacific Inc.,?,?,Aerospatiale SA316B,N3153R,1484,4,3,0,"While in cruise flight at an altitude of 150 to 200 feet agl, the surviving passenger heard abnormal sounds from the helicopter which then began a descending right bank into trees. Examination of the helicopter disclosed fatigue failure of the lower mixing unit and a fatigue crack in the upper mixing unit on the flight control system.",39.1910983,-106.8175387
"April 01, 1993",21:28,"Blountville, Tennesee",Private,?,"Bristol, TN - Blountville, TN",Fairchild SA227-TT,N500AK,TT-527,4,4,0,"The Hooters Restaurant private plane crashed 0.5 miles outside the Outer Marker while attempting to land at the Tri-Cities airport near Bristol, Tennessee. NASCAR Winston Cup Champion Alan Kulwicki, 38, killed. Failure of the pilot to follow procedures concerning use of the engine inlet anti-icing system while operating  in icing conditions, which resulted in ice ingestion and loss of engine power. Failure of the pilot to maintain airspeed while coping with the engine problem.",36.5331586,-82.32680599999999
"April 01, 1997",?,"Tegucigalpa, Honduras",Military - U.S. Air Force,?,Howard AFB - Tegucigalpa,Lockheed C-130H Hercules,88-4408,5161,10,3,0,"While landing the aircraft overran the runway, hit a concrete drainage ditch, when through a fence and came to rest on a highway where it caught fire.",14.0722751,-87.19213599999999
"April 01, 2000",08:00,"Near Gualeguaychu, Argentina",Taxval,?,?,Cessna 208 Caravan,LV-ZSR,208-00311,1,1,0,Crashed shortly after taking off in fog. The pilot was not qualified to fly in IFR conditions.,-33.0077778,-58.5111667
"April 01, 2002",07:25,"Near Cairns, QLD, Australia",Air Taxi,?,Cairns - Hicks Island,Shrike Commander 500S,VH-UJB,3152,4,4,0,"Crashed into low terrain while en route. Why the pilot continued flight into marginal weather conditions at an altitude that was insufficient to ensure terrain clearance, could not be established.",-16.9185514,145.7780548
"April 01, 2009",14:00,"Off Crimond, Scotland",Bond Offshore Helicopters,?,Miller field - Aberdeen,Eurocopter AS 332L2 Super Puma 2,G-REDL,?,16,16,0,The helicopter crashed 35 miles East of Crimond in the North Sea while transporting oil workers. A mayday was received prior to the crash. Catastrophic failure of the main rotor gearbox.,57.601426,-1.916038
"April 02, 1951",?,"Bogota, Colombia",AVIANCA,?,?,Douglas DC-3,HK-142,1957,26,26,0,?,4.710988599999999,-74.072092
"April 02, 1955",?,"Off Pensacola, Florida",Aaxico Airlines,?,"Mobile, AL - Macon, GA",Curtiss C-46A,N51424,30430,2,2,0,The cargo plane flew into a thunderstorm and crashed into the sea while en route.
"April 02, 1956",08:10,"Seattle, Washington",Northwest Orient Airlines,2,Seattle - Portland,Boeing 377 Stratocruiser 10-30,N74608,15954,38,5,0,The aircraft experienced extreme buffeting after taking off from Seattle. A decision was made to divert to McChord AFB but the plane continued to loose altitude and had to be ditched in Puget Sound 4.7 nautical miles southwest of Seattle. The plane sank within 15 minutes. The incorrect analysis of control difficulty which occurred on retraction of the wing flaps as a result of the flight engineer's failure to close the engine cowl flaps; the analysis having been made under conditions of urgency and within an extremely short period of time available for decision.,47.6062095,-122.3320708
"April 02, 1958",?,"Quito, Ecuador",Transportes Aereos Orientales,?,Quito - Esmeraldas,Junkers JU-52/3m,HC-SND,J5109,14,3,0,Crashed after experiencing engine trouble.,-0.1806532,-78.4678382
"April 02, 1967",?,"Off Lima, Peru",Caribbean Airlines,?,?,Lockheed 18 Lodestar,N706G,?,5,5,0,Ditched in the ocean.,-12.1318439,-76.97902789999999
"April 02, 1969",12:40,"Near Quang Tri, South Vietnam",Military - U.S. Army,?,?,Boeing Vertol CH47C (helicopter),67-18523,?,78,24,0,"As the helicopter was taking off in a vertical climb, there was a loss in rotor speed and the aircraft touched down on the edge of a ravine and rolled over causing the rotor blades to strike the ground and a fire to erupt.",16.7943472,106.963409
"April 02, 1969",12:50,"Off New Providence Island, Bahamas",Islands of the Bahamas Inc,?,?,Curtiss C-46F,N3914,22445,2,2,0,The cargo aircraft crashed into the ocean after a reported fire.,25.0519283,-77.4013403
"April 02, 1969",16:08,"Zawoja, Poland",LOT Polish Airlines,165,Warsaw - Cracow,Antonov AN-24V,SP-LTF,67302406,53,53,0,The aircraft was on a flight from Warsaw to Cracow when it crashed into the Babia Gora mountains. The aircraft deviated from its normal route in heavy fog for unknown reasons.,49.6680859,19.5821187
"April 02, 1970",00:55,"Cambridge, Maryland",East Coast Air - Air Taxi,?,"Teterboro, NJ - Cambridge, MD",Piper PA-32,N3241W,?,3,3,0,Collided with trees while attempting to land in fog.  Either misread or failed to read instruments correctly.,38.5631744,-76.0788292
"April 02, 1976",?,"Near Puerto Asis, Colombia",SATENA,?,Florencia - Puerto Asis,Douglas DC-3,FAC-676,?,16,5,0,Crashed into a lake while on approach.,0.504929,-76.500191
"April 02, 1986",?,"Near Athens, Greece",Trans World Airlines,840,Rome - Athens,Boeing B-727,N54340,20845/1066,121,4,0,Detonation of a explosive device in the passenger compartment causing four passengers to be sucked out.  The plane landed safely at Athens. The plastic explosive was left under a seat by a woman carrying a Lebanese passport.,37.9838096,23.7275388
"April 02, 1986",?,"Near Magdalena, New Mexico",Military - U.S. Air Force,?,?,Lockheed HC-130P Hercules,66-0211,4161,11,11,0,Lost a wing in heavy turbulence at low altitude.,34.1167305,-107.2439251
"April 02, 1987",17:30,"Near Skien, Norway",Scanex Air,?,"Hanover, West Germany - Skien, Norway",Beechcraft King Air C90,LN-KCR,LJ-0793,10,10,0,Crashed on approach five miles from it's destination.,59.2089131,9.605752599999999
"April 02, 1993",?,"Off Margarita Island, Venezuela",Linea Aeropostal Venezolana,?,Test,McDonnell Douglas DC-9-15,YV-03C,4700/83,11,11,0,Crashed into the sea after departing Caracas on a test flight.,10.9970723,-63.91132959999999
"April 02, 2001",16:30,"Ashbaubenon, Wisconsin",Jet Wings,?,"Green Bay - Ft. Myers, Fl",Cessna 501 Citation I/SP,N405PC,501-0150,1,1,0,"The positioning flight crashed into a building shortly after taking off. The pilot not maintaining aircraft control while maneuvering after takeoff and the pilot's inadequate preflight planning and preparation. Factors relating to the accident were the pilot's diverted attention while maneuvering after takeoff, the pilot's attempted VFR flight into instrument meteorological conditions, the pilot's visual lookout not being possible, the low ceiling, snow, and fog, the airplane's low altitude, and the building.",44.4822137,-88.0701033
"April 02, 2012",07:44,"Tyumen, Russia",UTAir,120,Tyurmen - Surgut,ATR 72-201,VP-BYZ,332,43,33,0,"After taking off, the plane lost height during the initial climb and crash landed in a snowy field, 1.5 miles past the end of the runway. The impact split the plane into three pieces.",57.1612975,65.5250172
"April 03, 1933",?,"Hemkenrode, Germany",Deutsche Lufthansa,?,?,Junkers F-13,D-534,?,2,1,0,?,52.2280802,10.706471
"April 03, 1939",?,"Near Marrakech, Morocco",Air France,?,?,Caudron C.635 Simoun,F-AOOT,7372,9,9,0,Crashed into a mountain.,31.6294723,-7.981084500000001
"April 03, 1954",?,"Kabassaak, Turkey",Devlet Hava Yollari,?,Adana - Istanbul,Douglas DC-3,TC-ARK,19509,25,25,0,"Exploded in midair about 25 miles from Adana, 15 minutes after takeoff from Adana."
"April 03, 1961",23:57,"Llico, Chile",LAN,210,Temuco - Santiago,Douglas DC-3,CC-CLD-P210,9716,24,24,0,The plane crashed into La Gotera Hill while on approach to Santiago. The official cause is unknown.  Icing suspected. All members of the Green Cross Chilean soccer team killed. Wreckage found 54 years after the accident.,-34.7635133,-72.0797766
"April 03, 1967",16:33,"Lexington, Kentucky",Lexington Air Taxi,-,?,Beech C-45H,N3727G,?,9,9,0,"A fire of undetermined origin occurred in the left engine nacelle during climb-out. Engine failure of undetermined origin. Inadequate preflight planning. Improperly loaded aircraft, weight and center of gravity.",38.0405837,-84.5037164
"April 03, 1983",?,"Guangzhou, China",Total,?,?,Beech Super King Air 200,F-BVRP,BB-0038,8,8,0,?,23.12911,113.264385
"April 03, 1994",16:36,"Lamoille, Nevada",Air Taxi - El Aero Services Inc.,?,?,Bell 206B3,N27736,2773,5,5,0,"The helicopter crashed shortly after takeoff. The ingestion of foreign material (snow) in the engine, which resulted in a flameout (loss of engine power). Factors related to the accident were: the adverse weather conditions (snow falling & high density altitude), the lack of snow covers to protect the engine intakes while parked and awaiting for the weather conditions to improve, improper planning/decision by the pilot and the company/operator management, inadequate information in the flight manual, and the lack of suitable terrain for an emergency landing.",40.7279868,-115.4784204
"April 03, 1996",14:52,"Near Dubrovnik, Croatia",Military - U.S. Air Force,21,Tizla - Dubrovnik,Boeing B-737-T43,73-1149,20696/347,35,35,0,"The aircraft strayed off course and hit St. John Hill at an altitude of 2,200 feet, 16km SE of Dubrovnik while attempting to land in poor weather conditions. U.S. Secretary of Commerce, Ron Brown, 55, killed. Crew error.  Failure of the crew to comply with directives that required a review of all instrument approach procedures, not approved by the Defense Dept. Preflight planning errors, combined with errors made during the flight by the crew. Rumors persist that the accident was a result of sabotage.",42.65066059999999,18.0944238
"April 03, 2008",11:00,"Lawa, Suriname",Blue Wing Airlines,?,Paramaribo - Lawa,Antonov An-28,PZ-TSO,1AJ007-17,19,19,0,While attempting to land the crew aborted the the approach and executed a go-around. Soon after the plane flew into a hillside.,5.8088874,-55.1909445
"April 04, 1933",12:30,"Off Barnegat, New Jersey",Military - U.S. Navy,?,?,Goodyear-Zeppelin U.S.S. Akron (airship),ZRS-4,?,76,73,0,"While cruising at 1,600 feet off New Jersey, strong air currents droped the ship to 700 feet before leveling off.  Before it could regain a safe height, it plummeted into the Atlantic Ocean. Decision by the commander to fly into a storm despite the presence of lightning.",39.76492229999999,-74.2693297
"April 04, 1943",01:40,North Sea,British Overseas Airways,?,"Stockholm, Sweden - RAF Leuchars, Scotland",Lockheed C-56B Lodestar,G-AGEJ,?,7,7,0,"Shot down  by German fighters, 30 miles from Skagen, Denmark",56.511018,3.515625
"April 04, 1954",?,"Hanoi, Vietnam",Autrex,?,?,Douglas C-54A,F-BFGQ,10341,4,4,0,The cargo plane crashed into the Red River while on approach.,21.0277644,105.8341598
"April 04, 1955",15:55,"Islip, New York",United Air Lines,?,Training,Douglas DC-6,N37512,43001/32,3,3,0,"Suddenly dove into the ground. Unintentional movement of no.4 throttle into the reverse range just before breaking ground, with the other three engines operating at high power output, which resulted in the aircraft very quickly becoming uncontrollable once airborne.",40.7298207,-73.2103934
"April 04, 1963",04:30,"Tatarstan, Russia",Operator,25,Moscow - :	Krasnoyarsk,Ilyushin IL-18,CCCP-75866,183005901,67,67,0,"Crashed in a snow covered field whille en route. The pitch control mechanism of the No. 4 prop failed, creating a severe drag. As the crew was not able to establish under these conditions which one of the right props had caused the problem both were feathered. The airplane entered a high speed descent from which the crew was unable to recover. Control was regained and the crew pulled up when breaking through the low clouds at 150-200 metres but elevators broke off. Control was lost and the airplane crashed.",55.1802364,50.7263945
"April 04, 1970",20:47,"Zaporozhye, Ukraine",Aeroflot,2903,Rostov - Zaporozhye,Ilyushin IL-14P,CCCP-52002,602111,35,7,0,The plane was destroyed when it crashed while on approach. The crew descended prematurely and was not monitored.,47.8388,35.139567
"April 04, 1974",02:35,"Francistown, Botswana",Wenela Air Services,?,Francistown - Malawi,Douglas DC-4,A2-ZER,27242,84,78,0,The aircraft crashed into trees and burst into flames after the engines overheated resulting in loss of power. The plane was carrying gold miners. Fuel contamination. Jet A fuel contaminated the aviation gasoline.,-21.1661005,27.5143603
"April 04, 1975",c 16:30,"Saigon, South Vietnam",Military - U.S. Air Force,?,Tan Son AFB - Clark AFB,Lockheed C-5A Galaxy,68-218,0021,330,155,0,"The aircraft reported it was returning to Tan Son Nhut Airbase 15 minutes after taking off. The aircraft was not able to make the airport and crashed landed into a rice paddy, 1.5 miles from the airport. The flight was evacuating 243 Vietnamese orphans. Pressure failure due to a faulty rear loading ramp caused decompression which led to severed rudder and elevator cables and loss of two hydraulic systems resulting in a loss of pitch control. Worst single non-combat U.S. military aviation disaster.",10.8230989,106.6296638
"April 04, 1977",16:19,"New Hope, Georgia",Southern Airways,242,Huntsville - Atlanta,McDonnell Douglas DC-9-31,N1335U,47393/608,85,62,8,The aircraft sustained a broken windshield and loss of power to both engines after penetrating a thunderstorm and encountering hail. The plane crash landed on a highway and exploded in flames. Total and unique loss of thrust from both engines while the aircraft was penetrating an area of severe thunderstorms with heavy precipitation and hail. The hail clogged bleeder valves in the engines causing multipe engine surges until the compressors tore apart. Contributing factor was the failure of the company's dispatcher to provide the flight crew with up-to-date severe weather information.,34.7275,-84.5088899
"April 04, 1978",23:20,"Off Galveston, Texas",Air Logistics,?,?,Bell 212,N140AL,?,6,3,0,The helicopter was attempting to land on an oil drilling platform. The co-pilot suffered spatial disorientation and stalled helicopter and crashed.,29.3013479,-94.7976958
"April 04, 1984",?,"Florianopolis, Brazil",Líder Táxi Aéreo,?,?,PT-LCN,PT-LCN,24-287,4,4,0,Crashed while landing.,-27.5953778,-48.5480499
"April 04, 1987",14:40,"Medan-Polonia, Indonesia",Garuda Indonesia Airlines,035,Banda Aceh - Medan,McDonnell Douglas DC-9-32,PK-GNQ,47741/836,45,27,0,The aircraft crashed on approach during heavy rain after hitting an antenna. Windshear.,3.5642564,98.6669345
"April 04, 1991",12:10,"Marion, Pennsylvania",Private,?,"Williamsport, PA  - Philadelphia, PA",Piper Aerostar 601 / Bell 412SP,N3645D / N78S,6108448162153/0151,5,5,2,"When the plane's nose gear indicator light did not illuminate a helicopter was dispatched to verify the nose gear was down. While making the inspection, the helicopter's blades accidentally hit the bottom of the plane sending both aircraft into the ground, killing all aboard both aircraft. Pennsylvania Senator H. John Heinz III was killed in the crash along with two children playing outside an elementary school. Two killed aboard the Bell and 3 aboard the Piper. The poor judgment by the captain of the airplane to permit the in-flight inspection after he had determined to the best of his ability that the nose landing gear was fully extended. The poor judgment of the captain of the helicopter to conduct the inspection and the failure of the flight crew of the helicopter to maintain safe separation.",39.8573144,-77.69527029999999
"April 04, 1991",13:40,"Lake Thutade, Canada",Central Mountain Air Services,?,Sturdee - Smithers,Douglas C-47B-15-DK,C-FQNF,26643,7,6,0,"The plane crash landed on a frozen lake after the crew flighing VFR, entered a snow storm.",56.8777487,-126.9978028
"April 04, 1992",?,"Near Baikov, Russia",Kamchatavia,?,Petropavlovsk -Baikov,Let 410UVP,CCCP-67130,800326,12,1,0,The cargo plane crashed into high ground 5 km short of the runway in poor weather during a VFR approach.
"April 04, 1994",14:46,"Amsterdam, Netherlands",KLM Cityhopper,433,Amsterdam - Cardiff,Saab 340B,PH-KSH,195,24,3,0,"Shortly after taking off, the plane experienced engine problems and returned to the airport. While attempting to land the aircraft rolled to the right, pitched up, stalled and crashed. Inadequate use of the flight controls during an asymmetric go-around resulting in loss of control. Contributing factors were insufficient understanding of the flightcrew of the SAAB 340B engine oil system, lack of awareness of the consequences of an aircraft configuration with one engine in flight idle and poor crew resource management.",52.3702157,4.895167900000001
"April 04, 1997",00:16,"Griffin, Georgia",Custom Air Service,?,Griffin - Americus,Aviation Traders ATL-98 Carvair,N83FA,10365,2,2,0,"On a positioning flight, while taking off the plane suffered engine failure, overran the runway and crashed into a vacant building.",33.2467807,-84.2640904
"April 04, 2001",?,"Adar Yeil, Sudan",Military - Sudan Air Force,?,Adar Yeil - Khartoum,Antonov AN-24,?,?,30,14,0,"The aircraft crashed on takeoff during a sandstorm, killing Sudan's deputy defense minister and 13 high-ranking military officers."
"April 04, 2011",13:30,"Kinshasa, Congo",United Nations,834,Kisangani - Kinshasa,Canadair CL-600 CRJ-100ER,4L-GAE,7070,33,32,0,"The plane operated on behalf of the United Nations Organization Stabilization Mission and was leased from Geogian Airways. While attempting to land in rain, thunderstorms and strong winds at Kinshasa, the plane missed the runway and crashed. Twenty eight passengers and crew of 4 were killed. One passenger survived. he inappropriate decision of the crew to continue the approach, in face of extremely inclement weather being displayed on their weather radar. Lack of adequate supervision by the Operator to ensure that its crew complied with established procedures including weather avoidance procedures and stabilized approach criteria.",-4.4419311,15.2662931
"April 04, 2016",1530,"Near Pigeon Forge, Tennessee",Smoky Mountain Helicopters,?,Sightseeing,Bell 206L,N16760,45081,5,5,0,The helicopter crashed in a wooded hillside while on a sightseeing flight..,35.7884241,-83.55433289999999
"April 05, 1946",c 11:15,"Rabat, Malta",Military - Royal British Navy,?,?,Vickers Wellington bomber,HE-274,?,4,4,16,"The Wellington was engaged in exercises with a Spitfire fighter. The fighter was using the Wellington as a dummy target and the Wellington was to take evasive action. When the bomber was between 4,000 and 5,000 feet altitude, it turned to port and started diving at 20 degrees. It kept on loosing altitude till it crashed into houses in the center of Rabat. No distress signal was transmitted to either the fighter pilot or ground control.  The probable cause of the accident was leakage of hydraulic fluid which somehow heated and released fumes in the cockpit rendering the crew unconcious.",35.8854994,14.373372
"April 05, 1948",?,"Near Berlin, Germany",British European Airways / Military - Soviet Air Force,?,?,Vickers Viking 1B & Soviet YAK-3 fighter,G-AIVP,229,15,15,0,"The aircraft was circling Gatow in preparation for landing when the DC-3 collided head on with the Russian Air Force Yakovlev 3 fighter, which was performing aerobatics. A total of 14 killed on the Vickers Viking and one on the YAK fighter. The collision was caused by the action of the Yak fighter's pilot, which was in disregard of the accepted rules of flying.",52.52000659999999,13.404954
"April 05, 1950",?,"Hatiara, India",Deccan Airways,?,?,Douglas C-47A,VT-CJD,12826,3,3,0,The cargo plane lost an engine on takeoff and attempted an emergency return but crashed. Overloaded.,22.6034621,88.4476565
"April 05, 1952",08:25,"New York, New York",US Airlines,4-2,"Raliegh, NC - New York, NY",Curtiss C-46F-1-CU,N1911M,22464,2,2,3,Violent engine surges and turbulence during a missed ILS approach caused the crew to loose control of the aircraft and crash at 171st St. and 89th Ave. in Queens. The no.1 engine fuel feed valve diaphragm  failed due to deterioration.,40.7127837,-74.0059413
"April 05, 1960",14:39,"Siuna, Nicaragua",Lanica,?,Siuna - Bonanza,Curtiss C-46A-40-CU,AN-AIN,26945,18,2,0,Flew into a hill shortly after taking off. Engine failure due to a  fatigue crack at a valve.,13.7405282,-84.7811621
"April 05, 1966",18:44,"Princeston, West Virginia",Layman Weikle - Taxi,?,?,Cessna 172D,N2486U,?,2,2,0,The aircraft crashed after an uncontrolled descent. Carbon Monoxide poisoning from defective exhaust muffler system.,37.3662293,-81.1025918
"April 05, 1976",08:19,"Ketchikan, Alaska",Alaska Airlines,60,Juneau - Ketchikan,Boeing B-727-81,N124AS,18821,50,1,0,The plane overran the runway after landing at excessive speed. The captain's faulty judgement in initiating a go-around after he was committed to a full stop landing following an excessively long and fast touchdown from an unstabilized approach.,55.34222219999999,-131.6461111
"April 05, 1978",16:45,"St. Thomas, Virgin Islands",Antilles Air,?,"St. John, VI - St. Croix, VI",Grumman G-21,N877A,?,9,2,0,Made a forced landing in water. Fuel starvation. Inattentiveness to fuel supply. Fuel selector positioned between tanks.,18.335361,-64.95340089999999
"April 05, 1988",?,"Combi, Cyprus",Kuwait Airways,?,Bangkok - Kuwait,Boeing B-747-200,9K-ADA,21541,112,2,0,Hijacking. Two hostages killed on the ground.
"April 05, 1991",14:51,"Brunswick, Georgia",Atlantic Southeast Airlines,2311,Atlanta - Brunswick,Embraer 120RT- Brasilia,N270AS,120-218,23,23,0,"Just after turning onto final approach, the aircraft suddenly rolled left until the wings were perpendicular to the ground and crashed in a nose down attitude 2 miles short of  the runway. Malfunction of the left engine propeller control unit which allowed the propeller blade angle to go below the flight idle position. Contributing to the accident was the deficient design of the propeller control unit by Hamilton Standard and the approval of the design by the FAA . Texas Senator John Tower, 66, his daughter and astronaut Manley ""Sonny"" Carter were among those killed.",31.1499528,-81.49148939999999
"April 05, 1996",14:44,"Near Petropavlovsk, Russia",Krasnoyarskie Avialinii,?,Novosibirsk - Petropavlovsk,Ilyushin IL-76TD,RA-76752,0093498967,20,20,0,"The cargo plane, carrying 57 tones of detergent, crashed into a mountain at an altitude of 2,900 feet. The airplane descended through clouds to an altitude of 900m and flew into the side of a mountain, 300m below the summit.",57.6011371,49.1219371
