Date,Time,Location,Operator,Flight No,Route,AC Type,Registration,CN / LM,Aboard,Fatalities,Ground,Summary,Latitude,Longitude
"August 12, 1985",18:56,"Mt. Osutaka, near Ueno Village, Japan",Japan Air Lines,123,Tokyo - Osaka,Boeing B-747-SR46,JA8119,20783/230,524,520,0,"The aircraft suffered an aft pressure bulkhead failure at 23,900 ft. The aircraft had severe control difficulties with loss of all controls and eventually after 40 minutes, collided with a mountain. Improper repair of the  bulkhead while being supervised by Boeing engineers after a tail strike in 1978. Worst single plane disaster in aviation history. Kyu Sakamoto, 43, famous for his Japanese song ""Sukiyaki"" was killed in the accident.",36.0159392,138.6878235
"August 12, 1985",?,"Mulia, Indonesia",Merpati Nusantara Airlines,?,?,de Havilland Canada DHC-6 Twin Otter 300,PK-NUG,346,19,8,0,?,-3.7312967,137.9614096
"August 12, 1994",21:05,"Whiting, New Jersey",Air Taxi - National Helicopters,?,"New York, NY - Atlantic City, NJ",Bell 206L-4,N124NH,52089,3,3,0,The non-instrument rated commercial pilot was en route at 2000 feet msl on a night VFR flight when he reported an inadvertent encounter with instrument meteorological conditions. The helicopter (N124NH) subsequently crashed in a wooded area while in a steep descent. Continued VFR flight into IMC.,39.9543627,-74.378734
"August 12, 1996",13:47,"Markham Bay, Canada",First Air,64,Iqaluit - Markham Bay,de Havilland Canada DHC-6 Twin Otter 300,C-GNDN,427,2,2,0,"After touching down, the cargo plane bounced twice and continued to the end of the runway, became airborne but crashed terrain. For unknown reasons, a decision was made to overshoot even though insufficient runway remained for acceleration, take-off, and climb. Likely contributing directly to the decision to overshoot was the difficulty in controlling the aircraft on touchdown.",43.8880114,-79.286502
"August 12, 1999",23:58,"Sept-Îles, Canada",Regionnair,347,Port-Menier - Sept-Iles,Beechcraft 1900D,C-FLIH,UE-347,4,1,0,Crashed after being cleared to land on Runway 31 using a straight-in approach at Sept-Îles Airport. The crew descended the aircraft well below safe minimum altitude while in instrument meteorological conditions and without having established any visual contact with the runway environment.,50.21329679999999,-66.3757921
"August 12, 2000",?,"Near Tshikapa, Congo",Staer Air,?,Kinshasa - Tshikapa,Antonov AN-26B,?,?,27,27,0,The plane was approaching Tshikapa and the pilot informed the tower that it was having difficulties with its landing gear. The tower told the pilot to do a low fly-by for an evaluation and then make an emergency landing but the pilot refused and attempted to return to Kinshasa. The plane crashed 40 miles north of Tshikapa.,-4.3340606,15.3127607
"August 12, 2015",0845,"Ninia, Indonesia",Komala Air,?,Wamena - Ninia,Pacific Aerospace,PK-KIG,650-0151,6,1,0,"Strong winds forced the crew to enter a holding pattern for 40 minutes. While attempting to land, the pilot touched down half-way down the runway and was unable to stop within the remaining distance. The plane overran the runway and went down an embankment before coming to rest. The copilot was killed.",-4.3050739,139.3450112
"August 13, 1935",?,"Hangow, China",China National Aviation Corporation,?,?,Sikorsky S-38B,NV40V,?,?,?,?,Destoryed in a storm.
"August 13, 1938",c 11:00,"Kiel, Germany",CSA Czech Airlines,?,"Prague - Paris, France",Savoia-Marchetti SM73,OK-BAG,?,17,16,0,Crashed into the Black Forest mountains in poor weather conditions. One stewardess survived.,54.3232927,10.1227652
"August 13, 1939",c 16:35,"Rio de Janerio, Brazil",Pan American World Airways,?,Miami - Rio de Janerio,Sikorsky S43 (flying boat),NC16933,?,16,14,0,"The plane lost power from the left engine, yawed to the left, and started a descending turn in the same direction. The plane continued to lose altitude and turn at a sharper and steeper angle until it struck a caisson anchored at right angles to a small island in the harbor immediately adjacent to its landing approach path.   Loss of power from the left engine during the landing approach, necessitating an attempted landing under extremely hazardous conditions.",-22.9068467,-43.1728965
"August 13, 1940",10:15,"Near Canberra, Australia",Military - Royal Australian Air Force,?,Melbourne - Canberra,Lockheed Hudson A16-97,?,?,10,10,0,"The plane was seen circling Canberra Aerodrome after which it headed west to make the final approach for landing. The aircraft momentarily disappeared behind one of the hills that surround the airport, then reappeared. There was the sound of engines being gunned, then the aircraft disappeared again. An explosion and sight  of a large plume of black smoke followed. All on board the Hudson were killed including several high ranking Australian military leaders. A witness later said the aircraft appeared to drop its left wing and then dip its nose steeply, classic symptoms of a stall, too close to the ground for recovery.",-35.3075,149.124417
"August 13, 1942",?,"Algiers, Algeria",Air France,?,?,Liore et Olivier H-246 Air Boat,F-AREJ,403,?,4,0,Attacked by Royal Air Force fighters.  Crashed in the water while attempting to land.,36.753768,3.0587561
"August 13, 1947",?,"Bucharest, Romania",Transporturile Aeriene Romano-Sovietice,?,Constanta - Bucharest,Lisunov Li-2,YR-TAV,18423801,3,3,0,?,44.4267674,26.1025384
"August 13, 1949",13:30,"Near Bogota, Colombia",SAETA,?,Bogota - Ibague,Douglas C-47,HK-1200,?,32,32,0,Crashed in the Andes mountains while  en route.,4.710988599999999,-74.072092
"August 13, 1961",?,"Near Pha Khao, Laos",Air America,?,?,Curtiss C-46F,B-136,22465,6,6,0,The cargo plane struck a mountain while dropping supplies.,18.6591233,104.6095976
"August 13, 1966",?,"Near Acapulco, Mexico",Aeronaves de Mexico,?,Training,Douglas DC-8-51,XA-PEI,45652/176,6,6,0,The plane crashed while on approah. Careless and untimely descent in the course of a procedure turn which was continued below established minimum altitude.,16.8531086,-99.8236533
"August 13, 1973",11:40,"Near La  Coruña, Spain",Aviaco Condor,118,Madrid - La Coruña,Sud-Aviation Caravelle 10-R,EC-BIC,225,85,85,1,"The aircraft experienced two missing landing attempts. On the third try, the crew tried to descent below minimum safe altitude to make visual contact with the ground. The right wing clipped trees and the aircraft crashed about 2 m from the runway. Attempting to land in meteorological conditions that were below minima.",43.3623436,-8.4115401
"August 13, 1974",18:35,"Anaktuvuk, Alaska",Merric Aviation - Air Taxi,?,"Dietrich, AK - Happy Valley, AK",de Havilland DHC-2,N7620,?,4,4,0,"Tried to fly through an obscure mountain pass, tried to turn around and hit the ground.",59.64250000000001,-151.5483333
"August 13, 1980",21:55,"Sa Cabaneta, Spain",Spantax,?,?,Learjet 35A,EC-DFA,35-196,4,4,0,Slamed into a mountain while on approach.,39.6206465,2.7495796
"August 13, 1989",21:25,"Janice, Mississippi",Private,?,"Hattiesburg, MS - Gulfport, MS",Cessna 177RG,N1976Q,177RG-0376,2,2,0,"The aircraft was flying from Hattiesburg to Gulfport. The non-instrument rated pilot lost control of the aircraft after encountering instrument meteorological conditions resulting in the airplane spiraling into the ground in a wooded area.  U.S. Representative from Mississippi, Larkin Smith, 45, was killed.",31.0254635,-89.03671659999999
"August 13, 2004",00:50,"Cincinnati, Ohio",Air Taroma,185,Memphis - Cincinnati,Convair CV-580,N586P,68,2,1,0,"While on approach at night,, the crew reported engine trouble. Shortly after the aircraft crashed on a golf course short of Runway 36R. Fuel starvation resulting from the captain's decision not to follow approved fuel crossfeed procedures. Contributing to the accident were the captain's inadequate preflight planning, his subsequent distraction during the flight, and contributing to the accident was the flightcrew's failure to monitor the fuel gauges and to recognize that the airplane's changing handling characteristics were caused by a fuel imbalance.",39.1031182,-84.5120196
"August 13, 2006",20:15,"Near Piacenza, Italy",Air Algerie,2208,"Algiers, Algeria - Frankfurt, Germany",Lockheed L-100-30 Hercules,7T-VHG,4880,3,3,0,The cargo plane crashed while en route in the vicinity of thunderstorms.,45.0526206,9.6929845
"August 13, 2008",07:30,"K-50 Airport, Somalia",Fly 540,?,Kenya - Somalia,Fokker F-27 Friendship 500,5Y-BVF,10627,3,3,0,While on approach in poor weather the cargo plane struck a telephone line and crashed.,2.0053407,44.9870299
"August 13, 2011",19:40,"Near McGrath, Alaska",Inland Aviation Services,?,McGarth - Anvik,Cessna 207,?,?,6,2,0,"The aircraft impacted mountainous, brush covered terrain, about 37 miles west of McGrath in low clouds, rain and reduced visibility. Pilot error. The pilot's decision to continue VFR flight into instrument meteorological conditions, which resulted in an in-flight collision with mountainous terrain.",62.9532043,-155.5959922
"August 14, 1921",?,"Toulouse, France",Aeropostale,?,?,Breguet 14,F-ALBI,?,2,2,0,?,43.604652,1.444209
"August 14, 1935",23:45,"Near Gilmer, Texas",Delta Air Lines,4,Dallas -  Atlanta,Stinson Model A,NC14599,9103,4,4,0,Crashed 3 miles south of Gilmer. The outboard engine separated from the aircraft after a propeller blade broke off resulting in an imbalanced condition which led to loss of control of the aircraft.,32.7287472,-94.94243790000002
"August 14, 1941",c 20:40,"Ayr, Scotland",Military - Royal Air Force,?,?,Consolidated LB-30A Liberator,AM260,?,22,22,0,"Crashed and burned on takeoff at Heathfield airfield, after veered off the runway and striking a small building and then an embankment.",55.458564,-4.629179000000001
"August 14, 1946",?,"Malta-Luqa, Malta",BOAC,?,?,Douglas C-47A,G-AGHT,10103,5,1,0,"The port engine and, later, the starboard engine failed as the result of fuel starvation. Circumstantial evidence suggests strongly that this was caused by the inadvertent selection of the auxiliary fuel tanks which at that time contained only a small amount of fuel.",35.8582865,14.4868883
"August 14, 1958",c 03:45,"North Atlantic Ocean, 100 miles W of Galway Bay, Ireland",KLM Royal Dutch Airlines,607E,Amsterdam - Shannon - Gander - New York,Lockheed 1049H Super Constellation,PH-LKM,4841,99,99,0,"The aircraft crashed into the sea while en route from Shannon to Gander, Newfoundland. Possible overspeeding of outer propeller."
"August 14, 1959",17:14Z,"Karachi, Pakistan",Pakistan International Airlines,?,?,Vickers 815 Viscount,AP-AJE,337,3,2,0,"The trainee captain attempted a maneuver in disregard of the prescribed limitations of such a maneuver. A two-engine overshoot was attempted at a very low height and below the prescribed minimum speed, when the aircraft was committed to a landing. This resulted in a violent yaw and sharp drop which could not be controlled. The training captain was conversant with the minimum requirements of a two-engine overshoot of the Viscount 815 aircraft but appears to have overestimated his performance.",24.8614622,67.0099388
"August 14, 1963",15:00,"Near Great Falls, Montana",American Air  Export & Import Co.,1814,?,Curtiss C-46F-1-CU,N67941,22391,2,1,0,"The aircraft lost an engine during takeoff and could not gain sufficient altitude, entered a canyon which forced a landing in a field causing the aircraft to strike a small earth dam. The failure of the captain to effect a proper and timely assessment of a power plant malfunction, followed by improper judgment and technique during a single-engine emergency operation.",47.4941836,-111.2833449
"August 14, 1968",09:35,"Compton, California",Los Angeles Airways,417,?,Sikorsky S-61L helicopter,N300Y,?,21,21,0,The main rotor blade of the helicopter separated from the central hub. The aircraft spun to destruction as the tail cone sheared off. Metallurgical fault during manufacture of the main rotor blade spindle. Fatigue origin in area of substandard hardness and inadequate shot peening on main rotor blade spindle.,33.8958492,-118.2200712
"August 14, 1972",17:00,"Near Konigs Wusterausen, East Germany",Interflug,?,Berlin - Birgas,Ilyushin IL-62,DM-SEA,00702,156,156,0,"In cargo bay 6, hot air, leaking from an air conditioning system, melted insulation off cabling causing a short circuit in the stabilizing system. Melting insulation ignited flammable fluid which led to an uncontrollable fire that eventually weakened the structure until the tail fell off.",52.2958906,13.6228382
"August 14, 1974",?,"Margarita Island, Venezuela",Linea Aeropostal Venezolana,?,Cumana - Porlamar,Vickers Viscount 749,YV-C-AMX,095,49,49,0,The flight crashed into La Gloria peak in a hurricane.,10.9970723,-63.91132959999999
"August 14, 1978",?,"Sogamoso, Bolivia",Aeropeca,?,?,Curtiss C-46,HK-1350,22557,18,18,0,"The aircraft, flying VFR, collided with a mountain in deteriorating weather condtions after being blown off course which went unnoticed because of lacking navigational equipment.",5.7160848,-72.93112889999999
"August 14, 1982",17:07,"Sukhumi, Georgia, USSR",Aeroflot / Aeroflot,?,Sukhumi - Kutaisi,Let 410UVP Turbojet / Tupolev TU-134V,67191 / 65836,781120 / 17113,11,11,0,Ground collision. Eleven killed on the LET and none on the Tupolev.,43.0015252,41.0234153
"August 14, 1982",c 09:00,"Near Managua, Nicaragua",Military - Nicaraguan Air Force,?,Managua - El Rodeo,Arava 201,223,?,20,20,0,Rolled to the right and crashed from an altitude of 500 ft. shortly after becoming airborne.,12.1149926,-86.2361744
"August 14, 1986",c 11:30,"Near Wampusirpi, Honduras",Military - Honduran Air Force,?,Tegucigalpa - Duzuna,Lockheed C130D,556,3194,59,59,0,Crashed into the jungle in poor weather conditions as it approached Durzana Air Base.,15.1961,-84.604637
"August 14, 1991",19:00,"Gustavus, Alaska",Air Taxi - Haines Airways Inc.,?,"Gustavus, AK - Haines, AK",Piper PA-32,N4075W,3240115,6,6,0,"Flew into a box canyon and crashed at an elevation of 4,000 ft.  VFR flight by the pilot into instrument meteorological conditions, and the pilot's failure to maintain sufficient altitude and/or clearance from mountainous terrain. Factors related to the accident were: the adverse weather and terrain conditions.",58.4133333,-135.7369444
"August 14, 1991",?,"Near Uricani, Romania",Tarom,?,Bucharest - Timisoara,Ilyushin IL-18V,YR-IMH,185008301,9,9,0,The cargo plane crashed in a rainstorm.,45.340086,23.1533879
"August 14, 1994",09:27,"Kenai, Alaska",Air Taxi - Lake Clark Air Inc.,?,"Merrill Field, AK - Port Alsworth, AK",Piper PA-32-260,N4839S,321268,4,3,0,"Suffered engine failure and made a crash landing on terrain near the shoreline of a body of water. Fatigue cracking of the engine case, which resulted in eventual damage to the #3 cylinder studs/engine through-bolts, subsequent separation of the #3 cylinder and piston, and an in-flight fire. Inadequate maintenance and inspection.",60.55444439999999,-151.2583333
"August 14, 1995",?,"Nevada del Huila, Colombia",AIRES Colombia,145,Neiva - Cali,Embraer 110P1 Bandeirante,HK-2594,110310,10,10,0,"Crashed into Nevado de Huila at an elevation of 14,500 feet.",2.9241666,-76.0291666
"August 14, 1996",?,"Near Bronson Creek, British Columbia, Canada",Air North,?,Bronson Creek - Wrangell,Douglas DC-4,C-FGNI,10389/120,3,1,0,"After taking off the  No. 2 engine of the cargo plane caught on fire. The pilot tried to land the plane in a river bed. The number 2 engine separated from the aircraft as a result of an intense fire in the wing. The loss of the engine rendered the aircraft uncontrollable, and the pilots were forced to land in the river.",56.7,-131
"August 14, 1997",16:35,"Tindal, NT, Australia",Air taxi,?,Sightseeing,Cessna 210,VH-PJQ,21062072,5,5,0,While flying at a low altitude the aircraft experienced engine trouble and crashed into trees. The engine failed due to fuel exhaustion. The pilot did not take advantage of suitable areas available for a forced landing. The aircraft stalled at a height from which recovery was not considered possible.,-14.4880292,132.3624025
"August 14, 2000",23:57,"Teslin Lake, British Columbia, Canada",RCMP-GRC Air Services,?,Teslin - Dease Lake,Cessna 208 Caravan I,C-GMPB,208-00082,2,2,0,"The float plane took off, entered a steep climb, stalled and crashed into the water. The pilot's decision to depart from the unlit location was likely the result of the many psychological and physiological stressors encountered during the day. The pilot most likely experienced spatial disorientation precipitated by local geographic and environmental conditions and lost control of the aircraft.",59.9132729,-132.3492168
"August 14, 2005",12:20,"Near Grammatikos, Greece",Helios Airways,522,"Larnaca, Cyprus - Athens, Greece - Prague, Czech Republic",Boeing 737-31S,5B-DBY,29099/2982,121,121,0,"While flying at FL340 towards Athens the crew reported problems with their air conditioning system. As the airliner entered Greek airspace ATC lost contact with the plane. Two Greek F-16 fighters were dispatched to intercept the plane. The F-16 pilots reported that one pilot was not in the cockpit and the other was slumped over the controls. They also said oxygen masks had deployed in the cabin. The plane continued on its programmed route to a holding pattern off the coast of Greece and flew in circles for two hours. Meanwhile, at least two flight attendants had stayed awake using portable oxygen bottles but they couldn't get through the locked, terrorist-proof cockpit door. It was only when one engine failed from fuel starvation that the computer-controlled systems aboard the plane unlocked the door. The plane continued on track until it crashed into mountainous terrain about 25 miles north of Athens. CVR tapes showed that a student pilot/flight attendant, Andreas Prodromou, was at the controls of the aircraft and tried to send a Mayday message twice but the radio was set to the wrong frequency. The cabin pressure control was left in the manual, instead of auto position by maintenance workers. The error was not picked up by the two pilots during three subsequent check lists. They failed to respond to warnings as oxygen masks fell in the passenger cabin which eventually  led to the two pilots losing consciousness and the plane crashing.",38.2031194,23.9632194
"August 14, 2013",04:49,"Birmingham, Alabama",United Parcel Service,1354,Louisville - Birmingham,Airbus A300F-622R,N155UP,841,2,2,0,"The cargo plane was on approach when it struck trees, crashed and burst into flames.",33.5206608,-86.80248999999999
"August 15, 1935",20:08,"Near Glendo, Wyoming",Aero Mayflower Transit Co,?,Helena - Denver,"Waco, model YLC",NC14140,?,3,3,0,"The plane flew into a mountain 43 miles West of Glendo in heavy fog.  Against advice to the contrary, the pilot decided to fly a direct route to Denver rather than go around, following the valleys and airways used by other pilots. The direct route took him across some of the most dangerous flying country in the west.",42.5027467,-105.0260832
"August 15, 1935",20:18,"Walakpa, near Point Barrow, Alaska",Private,?,?,Lockheed Orion 9E Explorer float plane,NR12283,195,2,2,0,"Dense fog caused the pilot to make a forced landing about 15 miles south of Point Barrow.  After some mechanical repairs, the plane took off, rose to about 50 feet and then crashed into shallow water. Loss of control of the aircraft at a low altitude after sudden engine failure due to the extreme nose-heaviness of the aircraft. Adventurer, Wiley Post, 37, and humorist, Will Rogers, 56, killed. Most experts believe that a combination of miscalculations in the design and operation of the heavily customized aircraft resulted in the uncontrollable spin that occurred right after takeoff.",64.2008413,-149.4936733
"August 15, 1938",?,"Guanabara, Brazil",Syndicato Condor,?,Guanabara - Victoria,Junkers JU-52/3m,PP-CAT,4024,9,9,0,"Flew into a mountain wave after taking off, went into a dive and crashed into Guanabara Bay.",-26.3204885,-48.8255373
"August 15, 1939",c 13;00,"Off Copenhagen, Denmark",British Airways,?,London - Hamburg - Copenhagen,Lockheed 10 Electra,G-ASEY,?,6,5,0,"Crashed into the sea after a fire aboard. Leakage of fuel from the overflow boxes, which resulted from overfilling of the fuel tanks.",55.6760968,12.5683371
"August 15, 1949",03:40,"Off Lurga Point, Ireland",Transocean Air Lines,?,Rome - Shannon,Douglas DC-3 (C-54A-DO),N79989,3076,58,8,0,"Fuel exhaustion forced the plane to ditch in the Atlantic Ocean, 15 km off the coast of Ireland. The plane stayed afloat for 15 minutes but 8 occupants died due to exposure or drowning. Failure of the captain to properly supervise the crew while en route."
"August 15, 1957",06:30,"Copenhagen, Denmark",Aeroflot,103,Riga - Copenhagen,Ilyushin IL-14P,CCCP-L1874,146000607,23,23,0,Crashed into the harbor after hitting the chimney of a factory. Crew error. ATC error.,55.6760968,12.5683371
"August 15, 1958",22:20,"Near Chita, Russia",Aeroflot,?,Khabarovsk - Irkutsk,Tupolev TU-104-A,CCCP-L5442,7350303,64,64,0,The aircraft stalled after flying over a thunderstorm. The aircraft climbed in excess of its operational ceiling considering its weight.,52.0515032,113.4711906
"August 15, 1958",?,"Nantucket, Massachusetts",Northeast Airlines,258,New York City - Nantucket,Convair CV-240-2,N90670,090,34,25,0,"The aircraft crashed 1,450 feet short of the runway while on approach in heavy fog. Poor judgement and technique by the pilot during approach in poor weather conditions. Nantucket Airport was not equipped with technology to permit insturment landings in such foggy conditions.",41.2834704,-70.099451
"August 15, 1959",16:42,"Calverton, New York",American Airlines,514,Training,Boeing 707-123,N7514A,17641/36,5,5,0,The crew failed to recognize and correct the development of excessive yaw which caused an unintentional rolling maneuver at an altitude too low to permit complete recovery.,40.90648729999999,-72.74343309999999
"August 15, 1966",18:45,"Anchorage, Alaska",NC Simpson - Taxi,?,?,Beech C-18S,N445,?,4,4,0,Fatigue fracture on right wing leading to inflight separation in flight.,61.2180556,-149.9002778
"August 15, 1973",14:50,"Don Don, Haiti",Private,?,Port Au Prince - Cap Haitien,Norman BN-2A-6,N38JA,211,10,10,0,Airframe failure in flight.,19.5269646,-72.2437813
"August 15, 1975",22:01,"Krasnovodsk, USSR",Aeroflot,A-53,?,Yakovlev YAK-40,CCCP-87323,9330230,38,23,0,The plane descended below the glidepath and crashed. Windshear.,40.0336591,52.9759299
"August 15, 1976",?,"Andes Mountains, Ecuador",SAETA,?,Quito - Cuenca,Vickers Viscount 785D,HC-ARS,377,59,59,0,Crashed while en route.
"August 15, 1984",?,"Near Wamena, Indonesia",Airfast Indonesia,?,?,Douglas C-47A,PK-OBC,12485,3,2,0,Crashed into a mountain while en route.,-4.0991845,138.9253206
"August 15, 1985",?,"Aden, Yemen",Alyemda Airlines,?,Aden - Abu Dahbi,Boeing 707-336C,7O-ACO,20374/838,73,3,0,"As the plane reached FL230, water was spilled on the autopilot panel and the crew had to disengage the autopilot because the stabilizer trim wheel started to rotate. Control was lost as the plane pitched up and down. Control was regained at 1,000 ft. and an emergency landing was carried out.",12.7854969,45.0186548
"August 15, 1988",?,Northern Afghanistan,Military - Afghan Republican Air Force,?,?,Antonov AN-22,?,?,39,39,0,Shot down by a surface-to-air missile.,34.34835899999999,62.1956286
"August 15, 1989",?,"Shanghai, China, China",China Eastern Airlines,?,Shanghai - Hongqiao,Antonov AN-24RV,B-3417,37309006,40,34,0,Lost power and crashed into a river shortly after taking off from Shanghai.,31.230416,121.473701
"August 15, 1991",?,?,Transports Aériens de la Guinee-Bissau,?,Kano - Bamako,Fokker F-27 Friendship 100,J5-GBB,10119,3,3,0,On a positioning flight the plane struck trees and broke up while attempting to land.
"August 15, 1997",19:30,"Criciúma, Brazil",Air taxi - TAM,?,?,Cessna 550 Citation II,PT-LML,550-0013,2,2,0,While en route the plane went into a steep dive and impacted terrain.,-28.6727702,-49.3733771
"August 15, 2000",08:25,"Lumber City, Georgia",Air Taxi,?,"Dothan, AL - Hazelhurst, GA",Piper PA-31-350,N801MW,31-8152136,3,3,0,While on approach the airplane collided with trees and the ground and subsequently burst into flames.  Pilot's failure to follow instrument procedures and descended below approach minimums and collided with trees.,31.9293488,-82.6795831
"August 15, 2002",12:35,"Kadjuduwa Watta, Sri Lanka",Military - Sri Lanka Air Force,?,?,Yunshuji Y-8D,CR-873,070802,5,5,0,"The military plane developed engine trouble while en route, tried to return to the airport but crashed into a paddy field and was destroyed."
"August 16, 1920",?,"Bedford, England",By Air,?,?,Armstrong-Whitworth F-K-8,G-EALW,?,1,1,0,The plane crashed during a cargo flight under unknown circumstances.,52.1359729,-0.4666546
"August 16, 1920",?,"College Park, Maryland",US Aerial Mail Service,?,?,De Havilland DH-4,317,?,1,1,0,"While approaching in poor visibility to land, the plane hit a radio mast and crashed in flames.",38.9896967,-76.93776
"August 16, 1954",?,"Near Pakse, Laos",Air Vietnam (South Vietnam),?,Red River delta - Saigon,Bristol 170 Freighter 21E,F-VNAI,12809,55,47,0,Crashed into the Mekong River while making an emergency landing after encountering engine failure. The aircraft was being used to evacuate families.,15.1105068,105.8172881
