Date,Time,Location,Operator,Flight No,Route,AC Type,Registration,CN / LM,Aboard,Fatalities,Ground,Summary,Latitude,Longitude
"February 27, 1990",19:47,"Denver, Colorado",Federal Express,?,Aspen - Denver,Cessna 208A Caravan I Cargomaster,N820FE,208-00043,1,1,0,"While on an ILS approach, the cargo plane encountered icing conditions. Subsequently it entered a steep descent and crashed short of the runway. The accumulation of structural ice and subsequent stalling of the aircraft. The icing condition was a related factor.",39.7392358,-104.990251
"February 27, 1996",05:40,"Near Lukapa, Angola",Aero Tropical,?,Ludana - Lukapa,Antonov 12BP,ER-ACE,402812,8,8,0,The cargo plane crashed in rain and poor visibility while on approach.,-8.4432485,20.7301263
"February 27, 2001",17:30,"Near Granton Harbour, Scotland",Loganair,670,Edinburgh - Belfast,Shorts 360-100,G-BNMT,SH3723,2,2,0,Double engine failure on take off cause the cargo plane to ditch in Firth of the Forth estuary. Icing.,56.4813248,-2.9665551
"February 28, 1942",?,Indian Ocean,British Overseas Airways,?,"Java - Broom, Australia",Short S-23 (flying boat),G-AETZ,S-842,20,20,0,Shot down by Japanese military aircraft about 150 miles from Java.,-33.137551,81.826172
"February 28, 1952",?,"Uberlandia,  Brazil",Panair do Brasil,?,Rio de Janeiro - Guiana,Douglas DC-3A,PP-PCN,3284,8,8,0,The right wing struck trees after attempting a go-around. Pilot error.,-18.9146078,-48.2753801
"February 28, 1963",21:29,"Boston, Massachusetts",Eastern Air Lines,?,?,Douglas DC-7,N842D,454448/944,26,0,1,"With engines idling, a girl ran into the No. 2 propeller despite warnings of ramp personnel. Suicide.",42.3600825,-71.0588801
"February 28, 1967",c 04:20,"Mactan, Philippines",Philippine Air Lines,345,Manila - Mactan,Fokker F-27 Friendship 100,PI-C501,10147,20,12,0,Crashed after undershooting the runway. Loss of control at low altitude. Improper loading which placed the center of gravity in back of the center of gravity limits of the plane.,10.2990463,123.9638531
"February 28, 1973",18:59,"Semipalatinsk, Kazakhstan",Aeroflot,256,Semipalatinsk - Karaganda,Yakovlev YAK-40,CCCP-87602,9120118,32,32,0,Crashed back on the the runway and broke apart. Official cause could not be determined.,50.4233463,80.250811
"February 28, 1973",23:52,"Near Szczecin, Poland",Military - Polish Air Force,?,Warsaw - Goleniow,Antonov AN-24B,012,?,18,18,0,"The aircraft crashed into a forest, 1.4 miles short of the runway, while attempting to land at Goleniow Airport  in rain and poor visibility. Icing. Captain did not turn on deicing equipment.",53.4285438,14.5528116
"February 28, 1973",?,"Near Nabire, Indonesia",Merpati Nusantara Airlines,?,?,de Havilland Canada DHC-6 Twin Otter 100,PK-NUC,70,13,13,0,Crashed while en route.,-3.3722254,135.5016253
"February 28, 1973",?,"Szczecin, Poland",Military - Polish Air Force,?,?,Antonov An-24B,012,97305702,15,15,0,Crashed while  en route. Twelve Interior Ministers of Poland and Czechoslovakia,53.4285438,14.5528116
"February 28, 1974",?,"Near Mehrabad, Iran",Military - Imperial Iranian Air Force,?,?,Lockheed C-130E Hercules,5-122,4393,10,10,0,?,34.200834,49.57001529999999
"February 28, 1977",?,"Near Saglouc, Canada",Survair,?,?,Douglas DC-3,C-FNAR,13154,10,4,0,Crashed in whiteout conditions.,62.20128500000001,-75.646856
"February 28, 1978",10:30,"Solvang, California",Security Air,?,"Visalia, CA - Santa Barbara, CA - Santa Maria, CA",Aero Commander 500A,N6143X,?,7,7,0,Continued VFR flight into adverse weather conditions.,34.5958201,-120.1376481
"February 28, 1984",16:16,"JFK Airport, New York, New York",Scandinavian Airlines (SAS),901,"Oslo, Norway, New York, NY",McDonnell Douglas DC-10-30,LN-RKB,46871,177,0,0,"While attempting to land at JFK, New York, the aircraft touched down 4,700 feet beyond the threshold, slid off end of runway and came to rest in a tidal waterway. The crew's disregard for prescribed procedures for monitoring and controlling of airspeed during the final stages of the approach and decision to continue the landing rather than to execute a missed approach. Overreliance on the autothrottle speed control system which had a history of recent malfunctions.",40.6413111,-73.77813909999999
"February 28, 1984",19:30,"Near Borja, Spain",Military - U.S. Air Force,?,?,Lockheed C-130E,68-10944,4324,18,18,0,Struck the face of a mountain as it made a low-level suppy drop during a training mission.,41.8337231,-1.5341785
"February 28, 1989",06:30,"Near Quebec City, Quebec, Canada",Transfair,?,?,Douglas C-47A,C-FBZN,25290,2,2,0,The cargo plane crashed after its initial climb.,46.8138783,-71.2079809
"February 28, 1993",?,"Off Green Island, Taiwan",Formosa Airlines,?,?,Dornier 228-201,B-12238,111,6,6,0,"The aircraft disappeared shortly before it was due to land and is believed to have crashed into the sea. Prior to the loss of contact, the flight had appeared to be proceeding normally. The accident occurred during daylight and in heavy rain."
"February 29, 1964",14:14,"Near Innsbruck, Austria",British Eagle International Airlines,802,London - Innsbruck,Bristol Britannia 312,G-AOVO,13423,83,83,0,"The aircraft crashed into Mt. Glungezer and then slid down a gorge, 10 miles ESE of the airport while in a holding pattern. The pilot descended below the minimum safe altitude in an apparent attempt to penetrate the overcast flying VFR in IFR conditions.",47.2692124,11.4041024
"February 29, 1968",22:43,"Near Bratsk, Russia",Aeroflot,15,Krasnoyarsk - 	Petropavlovsk,Ilyushin IL-18D,CCCP-74252,187010601,84,83,0,After an emergency situation and emergency descent the plane broke apart at FL100 and crashed. One passenger survived. Fuel leak.,56.17376609999999,101.6038976
"February 29, 1968",?,"Near Bratsk, Russia",Aeroflot,?,Krasnoyarsk - Petropavlovsk,Ilyushin IL-18D,CCCP-74252,187010601,82,82,0,"Cruising at flight level 260, some type of emergency developed. An abrupt descent was begun and accelerated until aerodynamic forces broke apart the plane. Cause unknown.",56.17376609999999,101.6038976
"February 29, 1996",20:25,"Arequipa, Peru",Compania de Aviacion Faucett SA (Peru),251,Lima - Arequipa,Boeing B-737-222,OB-1451,19072/86,123,123,0,"The aircraft crashed into a hillside several miles from the airport while attempting to land. The pilot reported flying at 9,500 ft. when the aircraft was actually flying 8,640 ft. Controlled flight into terrain.",-16.4090474,-71.53745099999999
"January 01, 1955",?,"Near Anchorage, Alaska",Military - US Air Force,?,Anchorage - Nome,Douglas C47,?,?,12,12,0,The pilot turned back to make an emergency landing at Skwentna Airport but hit a ridge a mile short of the runway.,61.2180556,-149.9002778
"January 01, 1966",05:30,"Kamchatsky, Russia",Aeroflot,?,Magadan - Petropavlovsk-Kamchatsky,Ilyushin IL-14P,CCCP-61618,602108,23,23,0,Crashed due to engine failure due to the destruction of the cylinder head number 12,53.0409109,158.6777259
"January 01, 1966",?,"Near Palembang, Sumatra, Indonesia",Garuda  Indonesia Airlines / Garuda Indonesia Airlines,?,?,Douglas DC-3 / Douglas DC-3,PK-GDU/PK-GDE,13463 / 19719,34,34,0,Midair collision between two Garuda aircraft. Both crashed into a swamp while approaching Palembang. Seventeen died on each aircraft.,-2.9253118,104.7943527
"January 01, 1970",00:30,"Nulato, Alaska",Galena Air Service - Air Taxi,?,"Nulato, AK - Tanana, AK",Cessna 180,N3472Y,?,4,2,0,Emergency flight to airlift sick patient. Collided with trees while en route. Pilot stayed low to maintain ground contact at night. Continued VFR flight into adverse weather conditions.,64.7194444,-158.1030556
"January 01, 1974",12:38,"Near Turin, Italy",Itavia,?,Bologna - Torino,Fokker F-28 Fellowship 1000,I-TIDE,11015,42,38,0,Crashed 2 miles short of the runway during an approach in fog and heavy rain.,45.070312,7.686856499999999
"January 01, 1976",c 05:30,"Near Al Qaysumah, Saudi Arabia",Middle East Airlines,438,Beirut - Dubai,Boeing B-720B-023B,OD-AFT,18020/165,82,82,0,The aircraft broke-up at FL 370 and crashed in the desert. Detonation of an explosive device in the forward cargo compartment.,28.308809,46.133339
"January 01, 1978",c 20:15,"Off Bandra, Maharashtra, India",Air India,855,Bombay - Dubai,Boeing B-747-237B,VT-EBD,19959/124,213,213,0,"Following a right turn, after taking off, the plane rolled to the left beyond 90 degrees, went into a steep dive, crashed and exploded in shallow water. Irrational control wheel inputs on the part of the captain after his attitude director indicator malfunctioned leading to complete loss of situational awareness.",19.0606917,72.8362497
"January 01, 1985",c 20:30,"Near La Paz, Bolivia",Eastern Air Lines,980,"Asuncion, Paraguay - La Paz, Bolivia",Boeing B-727-225 Adv,N819EA,22556/1793,29,29,0,"The aircraft hit Mt. Illimani at an altitude of 19,600 feet after being cleared to descend during an approach to La Paz. The crew did not follow the prescribed airway. Navigation error. Controlled flight into terrain.",-16.489689,-68.11929359999999
"January 01, 2002",18:02,"Hollywood, Florida",Air Taxi - Air Taxi Inc.,-,?,Piper PA-31-250,N3525Y,31-7952127,5,1,0,"The pilot declared an emergency and ditched into Atlantic Ocean, 300 yards off Dania Beach in 15 feet of water. The pilot's inadequate planning for a Title 14 CFR Part 135 on-demand air taxi flight, and his failure to refuel the airplane, which resulted in fuel exhaustion while en route over the Atlantic Ocean, a power off glide, and ditching in the ocean.",26.0112014,-80.1494901
"January 01, 2007",14:07,"Off Parepare, Indonesia",Adam Air,574,"Surabaya, East Java - Manado, Indonesia",Boeing B-737-4Q8,PK-KKW,24070,102,102,0,"While flying at FL350 the airliner went missing between Surabaya and Manado in poor weather conditions after the pilot reported strong winds. Wreckage was found 5 miles south of Parepare. The accident was caused by the autopilot being accidentally disconnected. The two pilots had been trying to fix a problem with the plane's navigation instruments when they disconnected the autopilot and lost control of the plane. Without the autopilot, the plane went out of control, listing to the right and pitching down. The IRS navigation system was repeatedly reported malfunctioning but was never repaired. This is what initially distracted the crew."
"January 01, 2009",04:37,"Lubock, Texas",Empire Airlines leased from FedEx,8284,Fort Worth - Lubbock,ATR-42-320,N902FX,175,2,2,0,"Crashed while attempting to land. The probable cause of this accident was the flight crew's failure to monitor and maintain a minimum safe airspeed while executing an instrument approach in icing conditions, which resulted in an aerodynamic stall at low altitude. Contributing to the accident were 1) the flight crew's failure to follow published standard operating procedures in response to a flap anomaly, 2) the captain's decision to continue with the unstabilized approach, 3) the flight crew's poor crew resource management, and 4) fatigue due to the time of day in which the accident occurred and a cumulative sleep debt, which likely impaired the captain's performance.",33.5778631,-101.8551665
"January 01, 2011",15:25,"Surgut, Russia",Kogalmavia,348,Surgut - Moscow,Tupolev Tu-154B-2,RA-85588,83A588,124,3,0,The passenger jet caught fire and exploded as it taxied for take off. Three passenger were killed and 43 injured during the evacuation. Electrical short.,61.25595029999999,73.38454709999999
"January 02, 1949",22:05,"Seattle, Washington",Seattle Air Charter,?,Seattle - New Haven,Douglas DC-3 (C-47A-DL),NC79025,10181,30,14,0,"The aircraft took off in fog with a group of Yale University students returning to school following their Christmas vacation.  About midway down the runway the plane swerved to the left and became airborne.  The left wing dropped the wing tip dragged on the runway.  After about 750 feet, the tail wheel made contact with the runway.  The engines were cut and the plane skidded for 700 feet until it hit a hanger and burst into flames.  The accident was caused by the crew's attempt to take off in an airplane which had formations of ice and frost on the surfaces of the wings.  In addition, the plane was overloaded by 1,500 lbs.",47.6062095,-122.3320708
"January 02, 1952",?,"Andapa, Madagascar",Air France,?,?,Junkers JU-52/3m,F-BAMQ,106,11,6,0,?,-14.658228,49.6452092
"January 02, 1954",?,"Herat, Afghanistan",Ariana Afghan Airlines,?,?,Douglas DC-3,?,?,21,21,0,Two Russian trade delegates were killed when the plane crashed near Herat.,34.352865,62.20402869999999
"January 02, 1961",?,"Ruzyne, Czechoslovakia",Ceskoslovenske Aerolinie,?,?,Avia 14,OK-MCZ,105807110,10,10,0,"Unable to gain altitude, the aircraft crashed into power cables during takeoff."
"January 02, 1965",09:57,"Near Darwaza, Russia",Aeroflot,?,Darwaza - Ashgabat,Li-2,CCCP-63842,6401,24,24,0,The plane took off and crashed. Fuel starvation.
"January 02, 1969",12:43,"Tyonek, Alaska",ERA Helicopter,?,?,Bell 205A,N4048G,?,2,2,0,The helicopter crashed into the water after a uncontrolled descent. Moisture in the servo cylinder vent ports froze causing the pilot valves ports to become inoperative causing the  pitch control to lock-up.,61.0680556,-151.1369444
"January 02, 1969",20:12,"Mt. Paku, Taiwan",China Airlines (Taiwan),227,Kaohsiung - Hualien,Douglas DC-3D,B-309,12541,24,24,0,Encountered extreme turbulence and downdrafts while en route.,24.9739053,121.7183349
"January 02, 1971",?,"Ben Gashir, Libya",United Arab Airlines,844,Algers - Boumediene,de Havilland Comet 4C,SU-ALC,6439,16,16,0,Crashed 7 kms from the runway in a sandstorm. Decision to land while visibility was below company minimums for that particular airport at night.,32.687778,13.173889
"January 02, 1973",08:34,"Edmonton, Alberta, Canada",Pacific Western Airlines,?,Toronto - Edmonton,Boeing 707-321C,CF-PWZ,18826/389,5,5,0,"Landing in poor visibility, turbulence and snow, the cargo plane came in for a landing at a high sink rate. The captain took over the controls to try to arrest the sink rate but the plane crashed into trees, a powerline and finally into a ridge short of the runway. The plane broke in two and was destroyed by fire.",53.544389,-113.4909267
"January 02, 1980",?,Haiti,Haïti Air Inter,?,Port au Prince - Cape Haitien,Britten Norman BN Islander,HH-CNC,474,9,9,0,Struck high ground in poor visibility while en route.,18.971187,-72.285215
"January 02, 1984",?,"Amman, Jordan",Military - Royal Jordanian Air Force,?,?,CASA 212-A3 Aviocar 100,324,55,13,13,0,Crashed due to mechanical problems.,31.9453666,35.9283716
"January 02, 1987",16:30,"Off Bata, Equatorial Guinea",Military - Spanish Air Force.,?,Bata - Malabo,CASA 212-100,T-12B-32,65,22,22,0,The domestic flight crashed off the island of Bioko and sending a distress message. Engine failure.,1.8533177,9.779022699999999
"January 02, 1988",19:20,"Izmir, Turkey",Condor Flugdienst,3780,Stuttgart - Izmir,Boeing B-737-230A,D-ABHD,22635/774,16,16,0,The aircraft was off the ILS sidebeam and crashed into a hill on approach in poor weather. The crew used the wrong VOR and ILS. Pilot overconfidence and co-pilot inactivity during the approach.,38.423734,27.142826
"January 02, 1990",13:40,"Java Sea, Indonesia",Pelita Air Service,?,Palambang and Jakarta,CASA 212 Aviocar 200,PK-PCM,217/57N,16,9,0,Ditched into the Java Sea after experiencing mechanical problems with the right engine and being unable to maintain altitude. The crew shut down the engine and feathered the propeller but could not maintain altitude despite jettisoning luggage out of the aircraft.,-5.0405666,112.6873468
"January 02, 1997",18:35,"Edenton, North Carolina",Tar Heel Aviation,?,Manteo - Edenton,Cessna 208B Grand Caravan,N802TH,208B-0179,2,2,0,"While on approach the plane struck power lines and came to rest in shallow water. The pilot's continued VFR flight into instrument meteorological conditions. Factors in this accident were; fog, the low ceiling, and the dark night.",36.057938,-76.6077213
"January 02, 1999",?,"Near Huambo, Angola",Transafrik - United Nations Charter,?,Huambo - Luanda,Lockheed L-100-30 Hercules,D2-EHD,4839,9,9,0,"he United Nations-chartered plane was shot down by UNITA rebels, 20 minutes after takeoff from Huambo.",-12.7739761,15.7468535
"January 02, 2006",11:11,Near Karkov,Evolga,?,Moscow - Karkov,British Aerospace BAe-125-700A,P4-AOD,257153,3,3,0,"On a positionning flight from Sheremetyevo to Kharkov to pick up passengers, while on final approach, the aircraft crashed in a frozen lake 3 km from runway threshold.",43.531705,2.589346
"January 02, 2013",20:57,"Near Clear Lake, Iowa",Med-Trans Corporaion,?,Mercy Hospital - Palo Alto Couonty Hospital,Bell 407,N445MT,53959,3,3,0,"The air ambulance crashed and burned north of Ventura near Clear Lake Iowa in ice, haze and misty conditons.",43.1435564,-93.3788108
"January 03, 1947",?,"Sao Paulo, Brazil",Panair do Brasil,?,?,Sikorsky S-43B (flying boat),PP-PBN,4315,14,11,0,"Crashed into the Solimoes River, an extension of the Amazon river.",-23.5505199,-46.63330939999999
"January 03, 1960",10:40,"Taksing, India",Indian Airlines,?,?,Douglas C-47A,VT-CGG,12821,9,9,0,"The cargo plane crashed while dropping supplies and making a narrow turn in a valley. The accident was attributed to an error in navigation which caused the pilot to enter the wrong valley. During an attempt to turn back in a restricted area, the aircraft stalled and crashed.",28.375797,93.24786399999999
"January 03, 1961",07:40,"Koivulahti, Finland",Finnair,311,Kokkola - Vaasa,Douglas DC-3,OH-LCC,14066/25511,25,25,0,"Crashed into woods while attempting to land. Both pilots tested positive for alcohol.  In addition, the pilot did not have enough sleep the night before and was not considered to be in satisfactory mental and physical condition to undertake the flight.",63.1606218,21.8418931
"January 03, 1965",21:03,"Alma-Ata, Kazakhstan",Aeroflot / Kazakhstan,101,Semipalatinsk - Alma-Ata,Ilyushin IL-18B,CCCP-75685,189001105,103,64,0,"During the approach the weather was below minima, but the crew was not aware of this. The plane deviated off course and the controller instructed the crew to execute a go-around but the captain continued the approach. The airplane struck the ground 75m short and to the right of the runway, crossed a ditch and struck trees.",43.2220146,76.8512485
"January 03, 1975",?,"Moscow, Russia",Aeroflot,?,?,Tupolev TU-124,CCCP-45037,351002,61,61,0,Crashed shortly after taking off.,55.755826,37.6173
"January 03, 1975",?,"Near Nha Trang, Vietnam",Air America,?,Da Lat - Nha Trang,Fairchild C-123K,ST-1,20074,9,9,0,Shot down with a SAM missile.,12.2387911,109.1967488
"January 03, 1976",10:05,"Moscow, Russia",Aeroflot,2003,Moscow - Vnukovo,Tupolev TU-124,CCCP-45036,3351001,61,61,1,"After taking off the plane entered clouds. Both artificial horizons failed. The plane rolled to the left  until it reached an angle of 95 degrees, descended and crashed.",55.755826,37.6173
"January 03, 1976",17:58,"Anchorage, Alaska",Winship Air,?,"Anchorage, AK - Deadhorse, AK",Lear Jet 24A,N651LJ,125,6,6,0,Crashed short of the runway in fog. The pilot descended below published minimums because of low fuel.  Inadequate preflight planning. Improper IFR operation.,61.2180556,-149.9002778
"January 03, 1984",?,"Novoagansk, Russia",Aeroflot,?,?,Mi-6,CCCP-21006,0239,76,38,0,The helicopter crashed on takeoff. Crew error.,61.9431337,76.66236339999999
"January 03, 1987",?,"Abidjan, Ivory Coast",Varig,797,Abidjan - Rio de Janeiro,Boeing B-707-379C,PP-VJK,19822/726,51,50,0,The plane crashed in the jungle while returning to Abidjan after taking off with the No. 1 engine on fire.,5.3599517,-4.0082563
"January 03, 1992",05:46,"Gabriels, New York",Commutair,4821,"Plattsburgh, NY - Saranac Lake, NY",Beechcraft 1900C,N55000,UC-135,4,2,0,"During the approach the aircraft struck trees and crashed near the top of a hill. Failure of the captain to establish a stabilized approach, his inadequate cross-check of instruments, his descent below the specified minimum altitude at the final approach fix and failure of the co-pilot to monitor the approach. The glide slope indications might have been unreliable due to precipitation and static interference.",44.43225380000001,-74.18023780000001
"January 03, 1993",15:40,"Ogden, Utah",Air Taxi - South Coast Helicopters Inc.,?,?,Bell 206B3,N1078V,2923,4,4,0,"The pilot was transporting personnel within a remote mountain valley in support of the commercial filming of celebrity skiers. The skiers had been filmed as they skied down a ridge, and were being flown back to the top of the ridge line. During the third go-around following three attempts to land on the ridge top landing site, the helicopter disappeared into a cloud bank and impacted the ridge at the 8,500-ft level. The pilot's continuation of VFR flight into instrument meteorological conditions, and his decision to continue his landing attempts under the adverse weather conditions.",41.223,-111.9738304
"January 03, 1994",12:08,"Near Mamony, Siberia, Russia",Baikal Air,130,Irkutsk - Moscow,Tupolev TU-154M,RA-85656,89A801,124,124,1,"The plane crashed during takeoff following a fire in the No. 2 engine and subsequent loss of the two remaining engines. Faulty air starter unit. Crew took off ignoring the ""starter warning light"" thinking it was false.  The crew underestimated the severity of the situation due to shortcomings in the operational documentation.  Breakup of the No.2 engine starter, damaging fuel and oil lines and causing a fire.",52.3048192,104.1551802
"January 03, 2004",04:44,"Off Sharm el Sheikh, Egypt",Flash Air,604,"Sharm el Sheikh, Egypt - Cairo, Egypt",Boeing B-737-3Q8,SU-ZCF,26283/2383,148,148,0,"Shortly after taking off,  the aircraft crashed into the Red Sea, 7 miles south of the airport. There were mostly French tourists on board heading home from the holidays. Possibly, the pilot suffered spatial disorientation and the copilot was unwilling to challenge his more experienced superior, however, no decisive cause was ever found.",27.9158175,34.3299505
"January 04, 1938",?,"Frankfurt, Germany",Deutsche Lufthansa,?,"Milan, Italy - Frankfurt, Germany",Junkers JU-52/3m,D-ABUR,5777,6,6,0,Icing on the wing caused the plane to crash close to the plane's destination.,50.1109221,8.6821267
"January 04, 2001",?,"Zheng Zou AB, China",Military - People's Liberation Army,?,Training,Shaanxi Yunshuji Y-8/Yunshuji Y-8,31242/31243,?,16,16,6,Two Antonov 12 planes collided in midair killing all aboard and 6 on the ground.,34.7670694,113.6813249
"January 04, 2002",12:07,"Birmingham, England",Agco Corp,?,"Birmingham, England - Bangor, MA",Canadair CL-604,N90AG,5414,5,5,0,"After taking off, banked to the left, wing contacted ground, a fire erupted and the aircraft broke up. Failure of the crew to de-ice the wings before takeoff. Possible impairment of crew performance by the combined effects of a non-prescription drug, jet-lag and fatigue were also considered factors.",52.48624299999999,-1.890401
"January 04, 2008",09:48,"Los Roques, Venezuela",Transaven,?,Los Rogues - Carac,Let 410 UVP-E3,YV2081,872051,18,18,0,The commuter airliner crashed into the sea while en route after the pilot reported engine problems.,11.8566815,-66.7665377
"January 04, 2009",15:30,Near Houma Louisiana,Petroleum Helicopters Inc,?,Bayou Penchant - Off shore oil fields,Sikorsky S-76C++,N748P,760629,9,8,0,"A helicopter bound for offshore oil fields went down about 75 miles southwest of New Orleans shortly after taking off. The sudden loss of power to both engines that resulted from impact with a red-tailed hawk, which fractured the windshield and interfered with engine fuel controls and the subsequent disorientation of the flightcrrew members. Also the lack of FAA regulations and guidance at the time the helicopter was certificated requiring helicopter windshields to be resistant to bird strikes and the lack of protections that would prevent T-handles from inadvertently dislodging out of the detents and the lack of a master warning light and audible system to alert the flightcrew of low-rotor speed conditions.",29.5957696,-90.71953479999999
"January 04, 2013",11:40,"Off Los Roques, Venezuela",Transaereo 5074,?,Los Roques - Caracas,Britten Norman BN-2A-27 Islander,YV-2615,20,6,6,0,"The flight disappeared while en route from Los Roques island to Caracas. When the plane was approximately 11 miles from Los Roques Airport, radar showed it began rapidly losing altitude and speed. It is presumed to have crashed in the ocean. The son of Italian designer Ottavio Missoni was among those onboard."
"January 05, 1929",?,"Stafford Springs, Connecticut",Colonial Air Transport,?,?,Fairchild FC-2,NC5650,111,1,1,0,Struck a mountain in poor weather,41.9542632,-72.3023022
"January 05, 1947",?,"Tsingtao, China",China National Aviation Corporation,?,Shanghai - Tsingtao - Beijing,Douglas DC-4,XT-T51,?,38,38,0,Crashed into  a mountain while on approach in low overcast.,36.067108,120.382609
"January 05, 1947",c 20:00,"Carmel, New Jersey",Nationwide Air Transport,?,Miami - Raleigh - Washington,Douglas DC-3,N50046,34373,23,3,0,"The aircraft diverted from Washington to Millville because of heavy traffic in the Washington area.  Near fuel exhaustion forced the crew to carry out an emergency landing. While maneuvering to find a suitable location during heavy snow, the aircraft struck trees and crashed. Failure of the Weather Bureau  to anticipate below minimum conditions north and south of Washington. Failure of CAA to transmit the flight plan to Millville in sufficient time to alert that station to the arrival of the flight.",39.4342818,-75.1212927
